### ISSUE TITLE
Connecting to running Swank server?

### ISSUE THREAD

**Issue by HiPhish** [l04m33/vlime#65]
I have a compiled application ([Nyxt browser](https://nyxt.atlas.engineer/)) which includes a Swank server that I can start on a given port. I would like to connect Vlime to that server, but either I am doing it wrong or there is something broken. Here is what I did:

- Start Nyxt and execute `start-swank` (starts the Swank server on port 4006)
- Start Neovim, open a Lisp buffer and press `<localleader>cc`
- I enter `127.0.0.1` and `4006` and the host and port respectively.
- Try to send `(+  2 3)` to the REPL by pressing `<localleader>si`, entering the expression and hitting `<CR>`

At this point I get an error:

```
Error detected while processing function vlime#ui#input#FromBufferComplete[14]..<lambda>28[1]..<SNR>207_CheckInputValidity[2]..<lam
bda>29[1]..vlime#ui#WithBuffer[19]..<SNR>192_SendToREPLInputComplete:
line    2:
E716: Key not present in Dictionary: "ListenerEval, [a:content, function('s:OnListenerEvalComplete')]))"
E116: Invalid arguments for function function
E116: Invalid arguments for function vlime#WithThread
Error detected while processing function vlime#ui#input#FromBufferComplete[14]..<lambda>28[1]..<SNR>207_CheckInputValidity:
line    2:
E171: Missing :endif
```

Afterwards the REPL buffer opens, but all it contains is

```
SWANK, remote 127.0.0.1:4006
============================
--
```

No expressions have been evaluated.

If I understand the documentation correctly, the Vim plugin does not communicate with the Swank server directly, but with a Vlime server, which then communicated with the Swank server. Is there a way of starting the Vlime server from within Vim and telling it to connect to the existing Swank server? Patching Nyxt to include the Vlime server is something I would very much want to avoid.

**Comment by HiPhish** [comment]
Update: after some more reading of the manual I have tried the following:

- Start SBCL and add the path to Vlime to the Quicklisp search paths: `(push #P"/home/hiphish/.local/share/nvim/site-packages/vlime/lisp/" ql:*local-project-directories*)`
- Load Vlime: `(ql:quickload :vlime)`
- Start the Swank server in Nyxt: `start-swank`
- Run the Vlime server, connecting to the running Swank server: `(vlime:main :port 7002 :start-swank nil :swank-port 4006)`
- In Neovim open up `init.lisp` and press `<localleader>cc`, enter the port of the Vlime server (7002)

I still get the same error message in Neovim and the console of the Vlime server shows:

```
CL-USER(12): (vlime:main :port 7002 :start-swank nil :swank-port 4006)

NIL
  <INFO> [22:43:20] vlime-usocket - Server created: (#(127 0 0 1) 7002)
CL-USER(13):   <INFO> [22:43:44] vlime-usocket - New client: #<USOCKET:STREAM-USOCKET {10040ED6B3}>
  <INFO> [22:43:44] vlime-usocket - Control thread stopping: (:SWANK-DATA-ERROR
                                                              #<SB-INT:SIMPLE-READER-PACKAGE-ERROR "Package ~A does not exist." {10042FD803}>)
```

**Comment by phmarek** [comment]
Can you create a transcript of the data being sent back and forth (eg. via `wireshark`, `tcpick`, or at least `strace`), so that we can see what is missing?

`vlime` depends on a few contribs, perhaps there's something that doesn't replies as expected.

**Comment by HiPhish** [comment]
This is all I got from TShark:

```
$ sudo tshark -f 'port 4006' -i any
Password:
Running as user "root" and group "root". This could be dangerous.
Capturing on 'any'
    1 0.000000000    127.0.0.1 → 127.0.0.1    TCP 76 58146 → 4006 [SYN] Seq=0 Win=65495 Len=0 MSS=65495 SACK_PERM=1 TSval=2204118391 TSecr=0 WS=128
    2 0.000017703    127.0.0.1 → 127.0.0.1    TCP 76 4006 → 58146 [SYN, ACK] Seq=0 Ack=1 Win=65483 Len=0 MSS=65495 SACK_PERM=1 TSval=2204118391 TSecr=2204118391 WS=128
    3 0.000031258    127.0.0.1 → 127.0.0.1    TCP 68 58146 → 4006 [ACK] Seq=1 Ack=1 Win=65536 Len=0 TSval=2204118391 TSecr=2204118391
    4 0.501867548    127.0.0.1 → 127.0.0.1    TCP 196 58146 → 4006 [PSH, ACK] Seq=1 Ack=1 Win=65536 Len=128 TSval=2204118893 TSecr=2204118391
    5 0.501888087    127.0.0.1 → 127.0.0.1    TCP 68 4006 → 58146 [ACK] Seq=1 Ack=129 Win=65408 Len=0 TSval=2204118893 TSecr=2204118893
    6 0.513019264    127.0.0.1 → 127.0.0.1    TCP 68 4006 → 58146 [FIN, ACK] Seq=1 Ack=129 Win=65536 Len=0 TSval=2204118904 TSecr=2204118893
    7 0.513208339    127.0.0.1 → 127.0.0.1    TCP 68 58146 → 4006 [ACK] Seq=129 Ack=2 Win=65536 Len=0 TSval=2204118905 TSecr=2204118904
```

**Comment by HiPhish** [comment]
Never mind, I'm a moron, I set Vlime in Neovim to listen to `4006` instead of `7002`. Here are the correct captures:

```
$ sudo tshark -f 'port 4006' -i any  # Swank server running inside Nyxt
Password:
Running as user "root" and group "root". This could be dangerous.
Capturing on 'any'
    1 0.000000000    127.0.0.1 → 127.0.0.1    TCP 76 58226 → 4006 [SYN] Seq=0 Win=65495 Len=0 MSS=65495 SACK_PERM=1 TSval=2204487619 TSecr=0 WS=128
    2 0.000018514    127.0.0.1 → 127.0.0.1    TCP 76 4006 → 58226 [SYN, ACK] Seq=0 Ack=1 Win=65483 Len=0 MSS=65495 SACK_PERM=1 TSval=2204487619 TSecr=2204487619 WS=128
    3 0.000031248    127.0.0.1 → 127.0.0.1    TCP 68 58226 → 4006 [ACK] Seq=1 Ack=1 Win=65536 Len=0 TSval=2204487619 TSecr=2204487619
    4 0.496900843    127.0.0.1 → 127.0.0.1    TCP 133 58226 → 4006 [PSH, ACK] Seq=1 Ack=1 Win=65536 Len=65 TSval=2204488116 TSecr=2204487619
    5 0.496917053    127.0.0.1 → 127.0.0.1    TCP 68 4006 → 58226 [ACK] Seq=1 Ack=66 Win=65536 Len=0 TSval=2204488116 TSecr=2204488116
    6 0.497684623    127.0.0.1 → 127.0.0.1    TCP 2002 4006 → 58226 [PSH, ACK] Seq=1 Ack=66 Win=65536 Len=1934 TSval=2204488117 TSecr=2204488116
    7 0.497693109    127.0.0.1 → 127.0.0.1    TCP 68 58226 → 4006 [ACK] Seq=66 Ack=1935 Win=64000 Len=0 TSval=2204488117 TSecr=2204488117
    8 0.498208956    127.0.0.1 → 127.0.0.1    TCP 68 58226 → 4006 [FIN, ACK] Seq=66 Ack=1935 Win=65536 Len=0 TSval=2204488117 TSecr=2204488117
    9 0.498964403    127.0.0.1 → 127.0.0.1    TCP 68 4006 → 58226 [FIN, ACK] Seq=1935 Ack=67 Win=65536 Len=0 TSval=2204488118 TSecr=2204488117
   10 0.498977177    127.0.0.1 → 127.0.0.1    TCP 68 58226 → 4006 [ACK] Seq=67 Ack=1936 Win=65536 Len=0 TSval=2204488118 TSecr=2204488118
```

```
$ sudo tshark -f 'port 7002' -i any  # Vlime server running in SBCL
Running as user "root" and group "root". This could be dangerous.
Capturing on 'any'
    1 0.000000000    127.0.0.1 → 127.0.0.1    TCP 76 43484 → 7002 [SYN] Seq=0 Win=65495 Len=0 MSS=65495 SACK_PERM=1 TSval=2204487610 TSecr=0 WS=128
    2 0.000013526    127.0.0.1 → 127.0.0.1    TCP 76 7002 → 43484 [SYN, ACK] Seq=0 Ack=1 Win=65483 Len=0 MSS=65495 SACK_PERM=1 TSval=2204487610 TSecr=2204487610 WS=128
    3 0.000021781    127.0.0.1 → 127.0.0.1    TCP 68 43484 → 7002 [ACK] Seq=1 Ack=1 Win=65536 Len=0 TSval=2204487610 TSecr=2204487610
    4 0.502008293    127.0.0.1 → 127.0.0.1    TCP 196 43484 → 7002 [PSH, ACK] Seq=1 Ack=1 Win=65536 Len=128 TSval=2204488112 TSecr=2204487610
    5 0.502031506    127.0.0.1 → 127.0.0.1    TCP 68 7002 → 43484 [ACK] Seq=1 Ack=129 Win=65408 Len=0 TSval=2204488112 TSecr=2204488112
    6 0.506976942    127.0.0.1 → 127.0.0.1    TCP 68 7002 → 43484 [FIN, ACK] Seq=1 Ack=129 Win=65536 Len=0 TSval=2204488117 TSecr=2204488112
    7 0.508230062    127.0.0.1 → 127.0.0.1    TCP 68 43484 → 7002 [ACK] Seq=129 Ack=2 Win=65536 Len=0 TSval=2204488119 TSecr=2204488117
    8 17.026596081    127.0.0.1 → 127.0.0.1    TCP 224 43484 → 7002 [PSH, ACK] Seq=129 Ack=2 Win=65536 Len=156 TSval=2204504637 TSecr=2204488117
    9 17.026613364    127.0.0.1 → 127.0.0.1    TCP 56 7002 → 43484 [RST] Seq=2 Win=0 Len=0
```

**Comment by phmarek** [comment]
Sorry... I meant that the _contents_ would be helpful, so that we see which commands are sent are what replies are received.

**Comment by HiPhish** [comment]
I have attached the Wireshark capture. GitHub won't let me upload `pcapng` files, so I have zipped it up instead and exported a PDF if you prefer that.

- [nyxt.zip](https://github.com/vlime/vlime/files/6619004/nyxt.zip)
- [nyxt.pdf](https://github.com/vlime/vlime/files/6619005/nyxt.pdf)

**Comment by HiPhish** [comment]
*bump* Anything useful in the logs?

**Comment by phmarek** [comment]
`VLIME` sends that:

```json
[1, [{"name": "EMACS-REX", "package": "KEYWORD"}, [{"name": "CONNECTION-INFO", "package": "SWANK"}], "COMMON-LISP-USER", true]]
[2, [{"name": "EMACS-REX", "package": "KEYWORD"}, [{"name": "SIMPLE-COMPLETIONS", "package": "SWANK"}, "+", "COMMON-LISP-USER"], "COMMON-LISP-USER", true]]
```
but gets no reply.

And this here is relayed to `swank`:
```
00003B(:emacs-rex (swank:connection-info) "COMMON-LISP-USER" t 1)000788(:return (:ok 
```

So it looks like the `vlime-server` part in your SBCL forwards the first query to `swank`, which answers; but either the `vlime-server` doesn't read, or doesn't relay the data.

Do you have any error messages visible? Can you run `nyxt` from an xterm or so, in case error messages appear there?

**Comment by HiPhish** [comment]
> Do you have any error messages visible? Can you run `nyxt` from an xterm or so, in case error messages appear there?

Yes, Nyxt does indeed display an error:

```
;; Swank started at port: 4006.
<INFO> [12:40:32] Swank server started at port 4006
;; swank:close-connection: end of file on #<SB-SYS:FD-STREAM for "socket 127.0.0.1:4006, peer: 127.0.0.1:40666" {100F20A453}>
```

That last line appears about a second or less after I have connected Neovim to Vlime.

**Comment by iamFIREcracker** [comment]
Hey, I was just trying the exact same thing, but like @HiPhish I could not make `vlime` to talk to the externally managed `swank` server.

## Steps to reproduce

Terminal 1 (`swank` server):

```
[SBCL] CL-USER> (ql:quickload "swank")
To load "swank":
  Load 1 ASDF system:
    swank
; Loading "swank"
.
("swank")

[SBCL] CL-USER> (swank:create-server :port 4005 :dont-close t)
;; Swank started at port: 4005.
4005
```

Terminal 2 (`vlime` server):

```
[SBCL] CL-USER> (load "~/opt/vlime/lisp/load-vlime.lisp")
WARNING:
   redefining EMACS-INSPECT (#<SB-PCL:SYSTEM-CLASS COMMON-LISP:T>) in DEFMETHOD
T

[SBCL] CL-USER> (vlime:main :port 7007 :start-swank nil :swank-port 4005)
NIL

[SBCL] CL-USER>   <INFO> [21:58:52] vlime-usocket - Server created: (#(127 0 0 1) 7007)
```

Terminal 3 (vim + vlime):

- Open `vim`
- Press `<localleader>cc` to connect to the Vlime server, and when prompted use `127.0.0.1` as Host, and `7007` as port number

## What happens

The following message gets logged inside Terminal 2 (Vlime server):

```
  <INFO> [22:01:26] vlime-usocket - New client: #<USOCKET:STREAM-USOCKET {100396C963}>
  <INFO> [22:01:27] vlime-usocket - Control thread stopping: (:CLIENT-DATA-ERROR
                                                              #<PACKAGE-DOES-NOT-EXIST "The name ~S does not designate any package." {1003FBF583}>)
```

While this is logged inside Terminal 1:

```
;; swank:close-connection: end of file on #<SB-SYS:FD-STREAM for "socket 127.0.0.1:4005, peer: 127.0.0.1:52924" {10024001E3}>
```

## Note

It does appear to be `vlime`-related, because if I bypass `vlime` I can get the `swank` server to execute my forms just fine.

Terminal 4:

```
[SBCL] CL-USER> (ql:quickload :swank-client)
To load "swank-client":
  Load 1 ASDF system:
    swank-client
; Loading "swank-client"

(:SWANK-CLIENT)

[SBCL] CL-USER> (swank-client:with-slime-connection (conn "localhost" 4005)
    (swank-client:slime-eval (quote (handler-bind ((error (function continue)))
                                      (format t "Hello, hot-reload!~&")))
                             conn))
NIL
```

And on Terminal 1 (Swank server) I can see:

```
Hello, hot-reload!
;; swank:close-connection: end of file on #<SB-SYS:FD-STREAM for "socket 127.0.0.1:4005, peer: 127.0.0.1:52975" {1001DB8A83}>
```

I even tried to start the `swank` server the way `vlime` does it, internally, with:

```
(let ((swank::*loopback-interface* "127.0.0.1"))
  (swank::setup-server 0
                       (lambda (port)
                         (format t "Announce-port: ~A~&" port))
                       :spawn
                       t
                       nil))
```

But this too does not seem to work -- i.e. when connecting to `vlime`'s server from vim, I get the same :CLIENT-DATA-ERROR exception.

[vlime.pcapng.zip](https://github.com/vlime/vlime/files/6650990/vlime.pcapng.zip)

**Comment by phmarek** [comment]
@HiPhish:
> Yes, Nyxt does indeed display an error:
> 
> ```
> ;; Swank started at port: 4006.
> <INFO> [12:40:32] Swank server started at port 4006
> ;; swank:close-connection: end of file on #<SB-SYS:FD-STREAM for "socket 127.0.0.1:4006, peer: 127.0.0.1:40666" {100F20A453}>
> ```
> 
> That last line appears about a second or less after I have connected Neovim to Vlime.

So the socket connection is closed for some reason - but we don't see that reason. Hmm.

@iamFIREcracker:
> But this too does not seem to work -- i.e. when connecting to vlime's server from vim, I get the same :CLIENT-DATA-ERROR exception.

Well, your capture file shows that the `INIT-PRESENTATIONS` and `CREATE-REPL` calls are not answered... so one of these might error out.


Do you have a way to use SBCL's interactive debugger when an error occurs?

**Comment by phmarek** [comment]
Short update: If I run `sbcl` and do `(ql:quickload :vlime)` in there, I can connect via vlime just fine.

(Though I'm currently on my experimental json-branch, where `swank` directly talks JSON to `vlime`....)

**Comment by iamFIREcracker** [comment]
@phmarek:

> Do you have a way to use SBCL's interactive debugger when an error occurs?

Actually, I am not really sure how to do that given that the error seems to be dealt with, internally; is there a way to intercept that? I guess I could look at the code and place few BREAKs?

Anyways, with a little bit of trial and error I was able to make this work; apparently, adding `(swank-loader:init :load-contribs t)` before the call to VLIME:MAIN inside Terminal 2 seems to do the trick, though I genuinely have no idea why would that be working.

So to recap:

### Terminal 1 (`swank` server) :

```
[SBCL] CL-USER> (ql:quickload "swank")
To load "swank":
  Load 1 ASDF system:
    swank
; Loading "swank"
.
("swank")

[SBCL] CL-USER> (swank:create-server :port 4005 :dont-close t)
;; Swank started at port: 4005.
4005

[SBCL] CL-USER> 
```

### Terminal 2 (`vim` + `vlime` server):

- Open `vim`
- Run `:term` and start `sbcl` in it
- Run the following:
```
[SBCL] CL-USER> (load "~/opt/vlime/lisp/load-vlime.lisp")
WARNING:
   redefining EMACS-INSPECT (#<SB-PCL:SYSTEM-CLASS COMMON-LISP:T>) in DEFMETHOD
T

[SBCL] CL-USER> (swank-loader:init :load-contribs t)
WARNING: Not reloading SWANK.  Package already exists.
WARNING:
   redefining THREAD-FOR-EVALUATION (#<STRUCTURE-CLASS SWANK::MULTITHREADED-CONNECTION>
                                     #<SB-MOP:EQL-SPECIALIZER :FIND-EXISTING>) in DEFMETHOD
NIL

[SBCL] CL-USER> (vlime:main :port 7007 :start-swank nil :swank-port 4005)
NIL

[SBCL] CL-USER>   <INFO> [21:30:57] vlime-usocket - Server created: (#(127 0 0 1) 7007)
```
- Press `<localleader>cc` to connect `vim` to `vlime`, and when prompted, use `127.0.0.1` as Host and `7007` as port number

Hopefully this time, you should see the following inside the REPL you run VLIME:MAIN on, and evaluating expressions should just...work!

```
<INFO> [21:33:17] vlime-usocket - New client: #<USOCKET:STREAM-USOCKET {1003684963}>
```

Any ideas why a call to `(swank-loader:init :load-contribs t)` is required here? I assume something is missing from the image VLIME:MAIN is run on...

**Comment by HiPhish** [comment]
I can recreate what @iamFIREcracker did and it works with a second SBCL REPL. But when i try the same thing connecting to Nyxt it still fails.

1. Start Nyxt, execute `start-swank`
2. Open a new SBCL REPL and enter the following:
```lisp
CL-USER(1): (push #P"/home/hiphish/.local/share/nvim/site-packages/vlime/lisp/" ql:*local-project-directories*)

(#P"/home/hiphish/.local/share/nvim/site-packages/vlime/lisp/"
 #P"/home/hiphish/.local/share/quicklisp/local-projects/")
CL-USER(2): (ql:quickload :vlime)
To load "vlime":
  Load 1 ASDF system:
    vlime
; Loading "vlime"
.
(:VLIME)
CL-USER(3): (swank-loader:init :load-contribs t)
WARNING: Not reloading SWANK.  Package already exists.
WARNING:
   redefining THREAD-FOR-EVALUATION (#<STRUCTURE-CLASS SWANK::MULTITHREADED-CONNECTION>
                                     #<SB-MOP:EQL-SPECIALIZER :FIND-EXISTING>) in DEFMETHOD

NIL
CL-USER(4): (vlime:main :port 7002 :start-swank nil :swank-port 4006)

NIL
  <INFO> [22:14:57] vlime-usocket - Server created: (#(127 0 0 1) 7002)
```
3. In `~/.config/nyxt` run `nvim init.lisp`
4. Press `<localleader>cc` to connect to the Vlime server, enter host and port (using the default values in this case)

SBCL prints
```
<INFO> [22:16:18] vlime-usocket - New client: #<USOCKET:STREAM-USOCKET {10046B29A3}>
  <INFO> [22:16:18] vlime-usocket - Control thread stopping: (:SWANK-DATA-ERROR
                                                              #<SB-INT:SIMPLE-READER-PACKAGE-ERROR "Package ~A does not exist." {10049D57C3}>)
```
The Nyxt console prints
```
;; swank:close-connection: end of file on #<SB-SYS:FD-STREAM for "socket 127.0.0.1:4006, peer: 127.0.0.1:33240" {10070E0D83}>
```

Here is the Wireshark capture:
- [nyxt.txt](https://github.com/vlime/vlime/files/6665676/nyxt.txt)
- [nyxt.pdf](https://github.com/vlime/vlime/files/6665678/nyxt.pdf)
- [nyxt.zip](https://github.com/vlime/vlime/files/6665679/nyxt.zip)

**Comment by iamFIREcracker** [comment]
I realized I could get `swank` to log all the events by running `(setf swank:*log-events* t)` on the image the Swank server runs on.  So I re-run `vlime` without `(swank-loader:init :load-contribs t)`, tried to connect to it, let it fail, and then I got the following logged on the Swank's image:

```
[SBCL] CL-USER> decode-message
decode-message
dispatch-event: (:EMACS-REX (SWANK:CONNECTION-INFO) "COMMON-LISP-USER" T 1)
wait-for-event: (:EMACS-REX . SWANK::_) NIL
send-event: #<SB-THREAD:THREAD "worker" waiting on: #<WAITQUEUE  {1001E00853}> {1001DF7D13}> (:EMACS-REX (SWANK:CONNECTION-INFO) "COMMON-LISP-USER" 1)
dispatch-event: (:RETURN #<SB-THREAD:THREAD "worker" FINISHED values: T {1001DF7D13}> (:OK (:PID 43025 :STYLE :SPAWN :ENCODING (:CODING-SYSTEMS ("utf-8-unix"
 "iso-latin-1-unix")) :LISP-IMPLEMENTATION (:TYPE "SBCL" :NAME "sbcl" :VERSION "2.1.4" :PROGRAM "/usr/local/Cellar/sbcl/2.1.4/libexec/bin/sbcl") :MACHINE (:I
NSTANCE "hairstyle.local" :TYPE "X86-64" :VERSION "Intel(R) Core(TM) i7-4650U CPU @ 1.70GHz") :FEATURES (:SWANK :QUICKLISP :ASDF3.3 :ASDF3.2 :ASDF3.1 :ASDF3 
:ASDF2 :ASDF :OS-MACOSX :OS-UNIX :NON-BASE-CHARS-EXIST-P :ASDF-UNICODE :X86-64 :GENCGC :64-BIT :ANSI-CL :BSD :COMMON-LISP :DARWIN :IEEE-FLOATING-POINT :LITTL
E-ENDIAN :MACH-O :PACKAGE-LOCAL-NICKNAMES :SB-CORE-COMPRESSION :SB-LDB :SB-PACKAGE-LOCKS :SB-THREAD :SB-UNICODE :SBCL :UNIX) :MODULES ("SB-CLTL2" "SB-INTROSP
ECT" "SB-BSD-SOCKETS" "SB-POSIX" "ASDF" "asdf" "UIOP" "uiop") :PACKAGE (:NAME "COMMON-LISP-USER" :PROMPT "CL-USER") :VERSION "2.26.1")) 1)
encode-message
decode-message
dispatch-event: (:EMACS-REX (SWANK:SWANK-REQUIRE (QUOTE (:SWANK-ASDF :SWANK-PACKAGE-FU :SWANK-PRESENTATIONS :SWANK-FANCY-INSPECTOR :SWANK-C-P-C :SWANK-ARGLIS
TS :SWANK-REPL :SWANK-FUZZY))) "COMMON-LISP-USER" T 2)
send-event: #<SB-THREAD:THREAD "worker" RUNNING {1001E03823}> (:EMACS-REX (SWANK:SWANK-REQUIRE (QUOTE (:SWANK-ASDF :SWANK-PACKAGE-FU :SWANK-PRESENTATIONS :SW
ANK-FANCY-INSPECTOR :SWANK-C-P-C :SWANK-ARGLISTS :SWANK-REPL :SWANK-FUZZY))) "COMMON-LISP-USER" 2)
wait-for-event: (:EMACS-REX . SWANK::_) NIL
WARNING:
   redefining THREAD-FOR-EVALUATION (#<STRUCTURE-CLASS SWANK::MULTITHREADED-CONNECTION>
                                     #<SB-MOP:EQL-SPECIALIZER :FIND-EXISTING>) in DEFMETHOD
dispatch-event: (:INDENTATION-UPDATE (("with-timeout" 1 ("SB-X86-64-ASM" "SB-DISASSEM" "SB-RBTREE" "SB-VM" "SB-GRAY" "SB-REGALLOC" "SB-PRETTY" "SB-FASL" "SB-
BIGNUM" "SB-BSD-SOCKETS-INTERNAL" "SB-LOCKLESS" "SB-KERNEL" "SB-PCL" "SB-DEBUG" "SB-DI" "SB-FORMAT" "SB-PROFILE" "SB-SYS" "SB-EVAL" "SB-WALKER" "COMMON-LISP-
USER" "SB-ALIEN" "SB-UNIX" "SB-IMPL" "SB-APROF" "SB-ASSEM" "SB-C" "SB-EXT")) ("with-current-source-form" 1 ("SB-X86-64-ASM" "SB-DISASSEM" "SB-RBTREE" "SB-VM"
 "SB-GRAY" "SB-REGALLOC" "SB-PRETTY" "SB-FASL" "SB-BIGNUM" "SB-BSD-SOCKETS-INTERNAL" "SB-LOCKLESS" "SB-KERNEL" "SB-PCL" "SB-DEBUG" "SB-DI" "SB-FORMAT" "SB-PR
OFILE" "SB-SYS" "SB-EVAL" "SB-WALKER" "COMMON-LISP-USER" "SB-ALIEN" "SB-UNIX" "SB-IMPL" "SB-APROF" "SB-ASSEM" "SB-C" "SB-EXT")) ("with-locked-hash-table" 1 (
"SB-X86-64-ASM" "SB-DISASSEM" "SB-RBTREE" "SB-VM" "SB-GRAY" "SB-REGALLOC" "SB-PRETTY" "SB-FASL" "SB-BIGNUM" "SB-BSD-SOCKETS-INTERNAL" "SB-LOCKLESS" "SB-KERNE
L" "SB-PCL" "SB-DEBUG" "SB-DI" "SB-FORMAT" "SB-PROFILE" "SB-SYS" "SB-EVAL" "SB-WALKER" "COMMON-LISP-USER" "SB-ALIEN" "SB-UNIX" "SB-IMPL" "SB-APROF" "SB-ASSEM
" "SB-C" "SB-EXT")) ("with-unlocked-packages" 1 ("SB-X86-64-ASM" "SB-DISASSEM" "SB-RBTREE" "SB-VM" "SB-GRAY" "SB-REGALLOC" "SB-PRETTY" "SB-FASL" "SB-BIGNUM" 
"SB-BSD-SOCKETS-INTERNAL" "SB-LOCKLESS" "SB-KERNEL" "SB-PCL" "SB-DEBUG" "SB-DI" "SB-FORMAT" "SB-PROFILE" "SB-SYS" "SB-EVAL" "SB-WALKER" "COMMON-LISP-USER" "S
B-ALIEN" "SB-UNIX" "SB-IMPL" "SB-APROF" "SB-ASSEM" "SB-C" "SB-EXT")) ("without-package-locks" 0 ("SB-X86-64-ASM" "SB-DISASSEM" "SB-RBTREE" "SB-VM" "SB-GRAY" 
"SB-REGALLOC" "SB-PRETTY" "SB-FASL" "SB-BIGNUM" "SB-BSD-SOCKETS-INTERNAL" "SB-LOCKLESS" "SB-KERNEL" "SB-PCL" "SB-DEBUG" "SB-DI" "SB-FORMAT" "SB-PROFILE" "SB-
SYS" "SB-EVAL" "SB-WALKER" "COMMON-LISP-USER" "SB-ALIEN" "SB-UNIX" "SB-IMPL" "SB-APROF" "SB-ASSEM" "SB-C" "SB-EXT")) ("define-source-context" 2 ("SB-X86-64-A
SM" "SB-DISASSEM" "SB-RBTREE" "SB-VM" "SB-GRAY" "SB-REGALLOC" "SB-PRETTY" "SB-FASL" "SB-BIGNUM" "SB-BSD-SOCKETS-INTERNAL" "SB-LOCKLESS" "SB-KERNEL" "SB-PCL" 
"SB-DEBUG" "SB-DI" "SB-FORMAT" "SB-PROFILE" "SB-SYS" "SB-EVAL" "SB-WALKER" "COMMON-LISP-USER" "SB-ALIEN" "SB-UNIX" "SB-IMPL" "SB-APROF" "SB-ASSEM" "SB-C" "SB
-EXT")) ("define-cas-expander" 2 ("SB-X86-64-ASM" "SB-DISASSEM" "SB-RBTREE" "SB-VM" "SB-GRAY" "SB-REGALLOC" "SB-PRETTY" "SB-FASL" "SB-BIGNUM" "SB-BSD-SOCKETS
-INTERNAL" "SB-LOCKLESS" "SB-KERNEL" "SB-PCL" "SB-DEBUG" "SB-DI" "SB-FORMAT" "SB-PROFILE" "SB-SYS" "SB-EVAL" "SB-WALKER" "COMMON-LISP-USER" "SB-ALIEN" "SB-UN
IX" "SB-IMPL" "SB-APROF" "SB-ASSEM" "SB-C" "SB-EXT")) ("do-blocks" 1 ("SB-X86-64-ASM" "SB-VM" "SB-REGALLOC" "SB-CLTL2" "SB-FASL" "SB-C")) ("define-source-tra
nsform" 2 ("SB-X86-64-ASM" "SB-VM" "SB-REGALLOC" "SB-CLTL2" "SB-FASL" "SB-C")) ("def-ir1-translator" 2 ("SB-X86-64-ASM" "SB-VM" "SB-REGALLOC" "SB-CLTL2" "SB-
FASL" "SB-C")) ("defoptimizer" 2 ("SB-X86-64-ASM" "SB-VM" "SB-REGALLOC" "SB-CLTL2" "SB-FASL" "SB-C")) ("defknown" 4 ("SB-X86-64-ASM" "SB-VM" "SB-REGALLOC" "S
B-CLTL2" "SB-FASL" "SB-C")) ("deftransform" 2 ("SB-X86-64-ASM" "SB-VM" "SB-REGALLOC" "SB-CLTL2" "SB-FASL" "SB-C")) ("do-nodes-backwards" 1 ("SB-X86-64-ASM" "
SB-VM" "SB-REGALLOC" "SB-CLTL2" "SB-FASL" "SB-C")) ("xdefun" 3 ("SB-X86-64-ASM" "SB-VM" "SB-REGALLOC" "SB-CLTL2" "SB-FASL" "SB-C")) ("sc-case" 1 ("SB-X86-64-
ASM" "SB-VM" "SB-REGALLOC" "SB-CLTL2" "SB-FASL" "SB-C")) ("do-nodes" 1 ("SB-X86-64-ASM" "SB-VM" "SB-REGALLOC" "SB-CLTL2" "SB-FASL" "SB-C")) ("do-forms-from-i
nfo" 1 ("SB-X86-64-ASM" "SB-VM" "SB-REGALLOC" "SB-CLTL2" "SB-FASL" "SB-C")) ("define-vop" 1 ("SB-X86-64-ASM" "SB-VM" "SB-REGALLOC" "SB-CLTL2" "SB-FASL" "SB-C
")) ("with-compiler-error-resignalling" 0 ("SB-X86-64-ASM" "SB-VM" "SB-REGALLOC" "SB-CLTL2" "SB-FASL" "SB-C")) ("define-move-fun" 3 ("SB-X86-64-ASM" "SB-VM" 
"SB-REGALLOC" "SB-CLTL2" "SB-FASL" "SB-C")) ("do-blocks-backwards" 1 ("SB-X86-64-ASM" "SB-VM" "SB-REGALLOC" "SB-CLTL2" "SB-FASL" "SB-C")) ("do-eql-vars" 1 ("
SB-C")) ("do-conset-constraints-intersection" 1 ("SB-C")) ("do-sc-pairs" 1 ("SB-C")) ("defpattern" 3 ("SB-X86-64-ASM" "SB-VM" "SB-REGALLOC" "SB-FASL" "SB-ASS
EM" "SB-C")) ("assemble" 1 ("SB-X86-64-ASM" "SB-VM" "SB-REGALLOC" "SB-FASL" "SB-ASSEM" "SB-C")) ("without-scheduling" 1 ("SB-X86-64-ASM" "SB-VM" "SB-REGALLOC
" "SB-FASL" "SB-ASSEM" "SB-C")) ("define-instruction-macro" 2 ("SB-X86-64-ASM" "SB-VM" "SB-REGALLOC" "SB-FASL" "SB-ASSEM" "SB-C")) ("acase" 1 ("QL-HTTP")) ("
match" 1 ("SWANK" "SWANK/MATCH")) ("with-output-to-cdb" 1 ("QL-CDB")) ("with-minimax-value" 1 ("SB-LOOP")) ("with-sum-count" 1 ("SB-LOOP")) ("with-loop-list-
collection-head" 1 ("SB-LOOP")) ("with-read-buffer" 1 ("SB-IMPL")) ("with-stepping-enabled" 0 ("SB-IMPL")) ("with-case-info" 1 ("SB-IMPL")) ("with-member-tes
t" 1 ("SB-IMPL")) ("do-vector-data" 1 ("SB-IMPL")) ("with-one-string" 1 ("SB-IMPL")) ("with-fd-setsize" 1 ("SB-UNIX")) ("with-program-output" 1 ("UIOP/RUN-PR
OGRAM")) ("with-program-input" 1 ("UIOP/RUN-PROGRAM")) ("with-program-error-output" 1 ("UIOP/RUN-PROGRAM")) ("with-alien" 1 ("SB-VM" "SB-REGALLOC" "SB-FASL" 
"SB-POSIX" "SB-BSD-SOCKETS-INTERNAL" "SB-KERNEL" "SB-THREAD" "SB-INT" "COMMON-LISP-USER" "SB-ALIEN" "SB-UNIX" "SB-IMPL" "SB-APROF" "SB-C" "SB-EXT")) ("alien-
lambda" 2 ("SB-ALIEN")) ("define-alien-callback" 3 ("SB-ALIEN")) ("with-auxiliary-alien-types" 1 ("SB-ALIEN")) ("pprofile" 0 ("COMMON-LISP-USER")) ("defun/pr
ofiled" 2 ("COMMON-LISP-USER")) ("walker-environment-bind" 1 ("SB-WALKER")) ("with-augmented-environment" 1 ("SB-WALKER")) ("with-new-definition-in-environme
nt" 1 ("SB-WALKER")) ("program-destructuring-bind" 2 ("SB-EVAL")) ("with-temporary-file" 1 ("QUICKLISP-CLIENT" "QL-DIST" "QL-UTIL" "QL-CONFIG")) ("without-pr
ompting" 0 ("QUICKLISP-CLIENT" "QL-DIST" "QL-UTIL" "QL-CONFIG")) ("in-interruption" 1 ("SB-X86-64-ASM" "SB-DISASSEM" "SB-VM" "SB-REGALLOC" "SB-FASL" "SB-LOCK
LESS" "SB-KERNEL" "SB-THREAD" "SB-DEBUG" "SB-DI" "SB-INT" "SB-SYS" "SB-ALIEN" "SB-UNIX" "SB-IMPL" "SB-APROF" "SB-C" "SB-EXT")) ("with-code-pages-pinned" 1 ("
SB-X86-64-ASM" "SB-DISASSEM" "SB-VM" "SB-REGALLOC" "SB-FASL" "SB-LOCKLESS" "SB-KERNEL" "SB-THREAD" "SB-DEBUG" "SB-DI" "SB-INT" "SB-SYS" "SB-ALIEN" "SB-UNIX" 
"SB-IMPL" "SB-APROF" "SB-C" "SB-EXT")) ("with-deadline" 1 ("SB-X86-64-ASM" "SB-DISASSEM" "SB-VM" "SB-REGALLOC" "SB-FASL" "SB-LOCKLESS" "SB-KERNEL" "SB-THREAD
" "SB-DEBUG" "SB-DI" "SB-INT" "SB-SYS" "SB-ALIEN" "SB-UNIX" "SB-IMPL" "SB-APROF" "SB-C" "SB-EXT")) ("with-local-interrupts" 0 ("SB-X86-64-ASM" "SB-DISASSEM" 
"SB-VM" "SB-REGALLOC" "SB-FASL" "SB-LOCKLESS" "SB-KERNEL" "SB-THREAD" "SB-DEBUG" "SB-DI" "SB-INT" "SB-SYS" "SB-ALIEN" "SB-UNIX" "SB-IMPL" "SB-APROF" "SB-C" "
SB-EXT")) ("with-interrupts" 0 ("SB-X86-64-ASM" "SB-DISASSEM" "SB-VM" "SB-REGALLOC" "SB-FASL" "SB-LOCKLESS" "SB-KERNEL" "SB-THREAD" "SB-DEBUG" "SB-DI" "SB-IN
T" "SB-SYS" "SB-ALIEN" "SB-UNIX" "SB-IMPL" "SB-APROF" "SB-C" "SB-EXT")) ("with-pinned-objects" 1 ("SB-X86-64-ASM" "SB-DISASSEM" "SB-VM" "SB-REGALLOC" "SB-FAS
L" "SB-LOCKLESS" "SB-KERNEL" "SB-THREAD" "SB-DEBUG" "SB-DI" "SB-INT" "SB-SYS" "SB-ALIEN" "SB-UNIX" "SB-IMPL" "SB-APROF" "SB-C" "SB-EXT")) ("without-gcing" 0 
("SB-X86-64-ASM" "SB-DISASSEM" "SB-VM" "SB-REGALLOC" "SB-FASL" "SB-LOCKLESS" "SB-KERNEL" "SB-THREAD" "SB-DEBUG" "SB-DI" "SB-INT" "SB-SYS" "SB-ALIEN" "SB-UNIX
" "SB-IMPL" "SB-APROF" "SB-C" "SB-EXT")) ("with-interrupt-bindings" 0 ("SB-X86-64-ASM" "SB-DISASSEM" "SB-VM" "SB-REGALLOC" "SB-FASL" "SB-LOCKLESS" "SB-KERNEL
" "SB-THREAD" "SB-DEBUG" "SB-DI" "SB-INT" "SB-SYS" "SB-ALIEN" "SB-UNIX" "SB-IMPL" "SB-APROF" "SB-C" "SB-EXT")) ("allow-with-interrupts" 0 ("SB-X86-64-ASM" "S
B-DISASSEM" "SB-VM" "SB-REGALLOC" "SB-FASL" "SB-LOCKLESS" "SB-KERNEL" "SB-THREAD" "SB-DEBUG" "SB-DI" "SB-INT" "SB-SYS" "SB-ALIEN" "SB-UNIX" "SB-IMPL" "SB-APR
OF" "SB-C" "SB-EXT")) ("without-interrupts" 0 ("SB-X86-64-ASM" "SB-DISASSEM" "SB-VM" "SB-REGALLOC" "SB-FASL" "SB-LOCKLESS" "SB-KERNEL" "SB-THREAD" "SB-DEBUG"
 "SB-DI" "SB-INT" "SB-SYS" "SB-ALIEN" "SB-UNIX" "SB-IMPL" "SB-APROF" "SB-C" "SB-EXT")) ("with-slime-interrupts" 0 ("SWANK")) ("while-collecting" 1 ("SWANK"))
 ("without-slime-interrupts" 0 ("SWANK")) ("define-channel-method" 2 ("SWANK")) ("with-describe-settings" 1 ("SWANK")) ("with-swank-error-handler" 1 ("SWANK"
)) ("with-retry-restart" 1 ("SWANK")) ("with-panic-handler" 1 ("SWANK")) ("without-printing-errors" 1 ("SWANK")) ("with-buffer-syntax" 1 ("SWANK")) ("with-bi
ndings" 1 ("SWANK")) ("with-connection" 1 ("SWANK")) ("defslimefun" 2 ("SWANK")) ("with-struct*" 1 ("SWANK")) ("with-top-level-restart" 1 ("SWANK")) ("restar
t-loop" 1 ("SWANK")) ("dcase" 1 ("SWANK")) ("with-string-stream" 1 ("SWANK")) ("with-io-redirection" 1 ("SWANK")) ("with-sane-io-syntax" 0 ("SB-X86-64-ASM" "
SB-DISASSEM" "SB-RBTREE" "SB-VM" "SB-GRAY" "SB-REGALLOC" "SB-PRETTY" "SB-CLTL2" "SB-FASL" "SB-BIGNUM" "SB-LOCKLESS" "SB-KERNEL" "SB-PCL" "SB-THREAD" "SB-DEBU
G" "SB-DI" "SB-FORMAT" "SB-PROFILE" "SB-INT" "SB-SYS" "SB-EVAL" "SB-WALKER" "SB-ALIEN" "SB-UNIX" "SB-UNICODE" "SB-IMPL" "SB-APROF" "SB-LOOP" "SB-ASSEM" "SB-C
" "SB-EXT" "SB-INTROSPECT")) ("binding*" 1 ("SB-X86-64-ASM" "SB-DISASSEM" "SB-RBTREE" "SB-VM" "SB-GRAY" "SB-REGALLOC" "SB-PRETTY" "SB-CLTL2" "SB-FASL" "SB-BI
GNUM" "SB-LOCKLESS" "SB-KERNEL" "SB-PCL" "SB-THREAD" "SB-DEBUG" "SB-DI" "SB-FORMAT" "SB-PROFILE" "SB-INT" "SB-SYS" "SB-EVAL" "SB-WALKER" "SB-ALIEN" "SB-UNIX"
 "SB-UNICODE" "SB-IMPL" "SB-APROF" "SB-LOOP" "SB-ASSEM" "SB-C" "SB-EXT" "SB-INTROSPECT")) ("dovector" 1 ("SB-X86-64-ASM" "SB-DISASSEM" "SB-RBTREE" "SB-VM" "S
B-GRAY" "SB-REGALLOC" "SB-PRETTY" "SB-CLTL2" "SB-FASL" "SB-BIGNUM" "SB-LOCKLESS" "SB-KERNEL" "SB-PCL" "SB-THREAD" "SB-DEBUG" "SB-DI" "SB-FORMAT" "SB-PROFILE"
 "SB-INT" "SB-SYS" "SB-EVAL" "SB-WALKER" "SB-ALIEN" "SB-UNIX" "SB-UNICODE" "SB-IMPL" "SB-APROF" "SB-LOOP" "SB-ASSEM" "SB-C" "SB-EXT" "SB-INTROSPECT")) ("with
-system-mutex" 1 ("SB-X86-64-ASM" "SB-DISASSEM" "SB-RBTREE" "SB-VM" "SB-GRAY" "SB-REGALLOC" "SB-PRETTY" "SB-CLTL2" "SB-FASL" "SB-BIGNUM" "SB-LOCKLESS" "SB-KE
RNEL" "SB-PCL" "SB-THREAD" "SB-DEBUG" "SB-DI" "SB-FORMAT" "SB-PROFILE" "SB-INT" "SB-SYS" "SB-EVAL" "SB-WALKER" "SB-ALIEN" "SB-UNIX" "SB-UNICODE" "SB-IMPL" "S
B-APROF" "SB-LOOP" "SB-ASSEM" "SB-C" "SB-EXT" "SB-INTROSPECT")) ("dx-let" 1 ("SB-X86-64-ASM" "SB-DISASSEM" "SB-RBTREE" "SB-VM" "SB-GRAY" "SB-REGALLOC" "SB-PR
ETTY" "SB-CLTL2" "SB-FASL" "SB-BIGNUM" "SB-LOCKLESS" "SB-KERNEL" "SB-PCL" "SB-THREAD" "SB-DEBUG" "SB-DI" "SB-FORMAT" "SB-PROFILE" "SB-INT" "SB-SYS" "SB-EVAL"
 "SB-WALKER" "SB-ALIEN" "SB-UNIX" "SB-UNICODE" "SB-IMPL" "SB-APROF" "SB-LOOP" "SB-ASSEM" "SB-C" "SB-EXT" "SB-INTROSPECT")) ("collect" 1 ("SB-X86-64-ASM" "SB-
DISASSEM" "SB-RBTREE" "SB-VM" "SB-GRAY" "SB-REGALLOC" "SB-PRETTY" "SB-CLTL2" "SB-FASL" "SB-BIGNUM" "SB-LOCKLESS" "SB-KERNEL" "SB-PCL" "SB-THREAD" "SB-DEBUG" 
"SB-DI" "SB-FORMAT" "SB-PROFILE" "SB-INT" "SB-SYS" "SB-EVAL" "SB-WALKER" "SB-ALIEN" "SB-UNIX" "SB-UNICODE" "SB-IMPL" "SB-APROF" "SB-LOOP" "SB-ASSEM" "SB-C" "
SB-EXT" "SB-INTROSPECT")) ("named-ds-bind" 3 ("SB-X86-64-ASM" "SB-DISASSEM" "SB-RBTREE" "SB-VM" "SB-GRAY" "SB-REGALLOC" "SB-PRETTY" "SB-CLTL2" "SB-FASL" "SB-
BIGNUM" "SB-LOCKLESS" "SB-KERNEL" "SB-PCL" "SB-THREAD" "SB-DEBUG" "SB-DI" "SB-FORMAT" "SB-PROFILE" "SB-INT" "SB-SYS" "SB-EVAL" "SB-WALKER" "SB-ALIEN" "SB-UNI
X" "SB-UNICODE" "SB-IMPL" "SB-APROF" "SB-LOOP" "SB-ASSEM" "SB-C" "SB-EXT" "SB-INTROSPECT")) ("awhen" 1 ("SB-X86-64-ASM" "SB-DISASSEM" "SB-RBTREE" "SB-VM" "SB
-GRAY" "SB-REGALLOC" "SB-PRETTY" "SB-CLTL2" "SB-FASL" "SB-BIGNUM" "SB-LOCKLESS" "SB-KERNEL" "SB-PCL" "SB-THREAD" "SB-DEBUG" "SB-DI" "SB-FORMAT" "SB-PROFILE" 
"SB-INT" "SB-SYS" "SB-EVAL" "SB-WALKER" "SB-ALIEN" "SB-UNIX" "SB-UNICODE" "SB-IMPL" "SB-APROF" "SB-LOOP" "SB-ASSEM" "SB-C" "SB-EXT" "SB-INTROSPECT")) ("with-
rebound-io-syntax" 0 ("SB-X86-64-ASM" "SB-DISASSEM" "SB-RBTREE" "SB-VM" "SB-GRAY" "SB-REGALLOC" "SB-PRETTY" "SB-CLTL2" "SB-FASL" "SB-BIGNUM" "SB-LOCKLESS" "S
B-KERNEL" "SB-PCL" "SB-THREAD" "SB-DEBUG" "SB-DI" "SB-FORMAT" "SB-PROFILE" "SB-INT" "SB-SYS" "SB-EVAL" "SB-WALKER" "SB-ALIEN" "SB-UNIX" "SB-UNICODE" "SB-IMPL
" "SB-APROF" "SB-LOOP" "SB-ASSEM" "SB-C" "SB-EXT" "SB-INTROSPECT")) ("doplist" 2 ("SB-X86-64-ASM" "SB-DISASSEM" "SB-RBTREE" "SB-VM" "SB-GRAY" "SB-REGALLOC" "
SB-PRETTY" "SB-CLTL2" "SB-FASL" "SB-BIGNUM" "SB-LOCKLESS" "SB-KERNEL" "SB-PCL" "SB-THREAD" "SB-DEBUG" "SB-DI" "SB-FORMAT" "SB-PROFILE" "SB-INT" "SB-SYS" "SB-
EVAL" "SB-WALKER" "SB-ALIEN" "SB-UNIX" "SB-UNICODE" "SB-IMPL" "SB-APROF" "SB-LOOP" "SB-ASSEM" "SB-C" "SB-EXT" "SB-INTROSPECT")) ("named-let" 2 ("SB-X86-64-AS
M" "SB-DISASSEM" "SB-RBTREE" "SB-VM" "SB-GRAY" "SB-REGALLOC" "SB-PRETTY" "SB-CLTL2" "SB-FASL" "SB-BIGNUM" "SB-LOCKLESS" "SB-KERNEL" "SB-PCL" "SB-THREAD" "SB-
DEBUG" "SB-DI" "SB-FORMAT" "SB-PROFILE" "SB-INT" "SB-SYS" "SB-EVAL" "SB-WALKER" "SB-ALIEN" "SB-UNIX" "SB-UNICODE" "SB-IMPL" "SB-APROF" "SB-LOOP" "SB-ASSEM" "
SB-C" "SB-EXT" "SB-INTROSPECT")) ("named-lambda" 2 ("SB-X86-64-ASM" "SB-DISASSEM" "SB-RBTREE" "SB-VM" "SB-GRAY" "SB-REGALLOC" "SB-PRETTY" "SB-CLTL2" "SB-FASL
" "SB-BIGNUM" "SB-LOCKLESS" "SB-KERNEL" "SB-PCL" "SB-THREAD" "SB-DEBUG" "SB-DI" "SB-FORMAT" "SB-PROFILE" "SB-INT" "SB-SYS" "SB-EVAL" "SB-WALKER" "SB-ALIEN" "
SB-UNIX" "SB-UNICODE" "SB-IMPL" "SB-APROF" "SB-LOOP" "SB-ASSEM" "SB-C" "SB-EXT" "SB-INTROSPECT")) ("with-fast-read-byte" 1 ("SB-X86-64-ASM" "SB-DISASSEM" "SB
-RBTREE" "SB-VM" "SB-GRAY" "SB-REGALLOC" "SB-PRETTY" "SB-CLTL2" "SB-FASL" "SB-BIGNUM" "SB-LOCKLESS" "SB-KERNEL" "SB-PCL" "SB-THREAD" "SB-DEBUG" "SB-DI" "SB-F
ORMAT" "SB-PROFILE" "SB-INT" "SB-SYS" "SB-EVAL" "SB-WALKER" "SB-ALIEN" "SB-UNIX" "SB-UNICODE" "SB-IMPL" "SB-APROF" "SB-LOOP" "SB-ASSEM" "SB-C" "SB-EXT" "SB-I
NTROSPECT")) ("with-progressive-timeout" 1 ("SB-X86-64-ASM" "SB-DISASSEM" "SB-RBTREE" "SB-VM" "SB-GRAY" "SB-REGALLOC" "SB-PRETTY" "SB-CLTL2" "SB-FASL" "SB-BI
GNUM" "SB-LOCKLESS" "SB-KERNEL" "SB-PCL" "SB-THREAD" "SB-DEBUG" "SB-DI" "SB-FORMAT" "SB-PROFILE" "SB-INT" "SB-SYS" "SB-EVAL" "SB-WALKER" "SB-ALIEN" "SB-UNIX"
 "SB-UNICODE" "SB-IMPL" "SB-APROF" "SB-LOOP" "SB-ASSEM" "SB-C" "SB-EXT" "SB-INTROSPECT")) ("do-packed-varints" 1 ("SB-X86-64-ASM" "SB-DISASSEM" "SB-RBTREE" "
SB-VM" "SB-GRAY" "SB-REGALLOC" "SB-PRETTY" "SB-CLTL2" "SB-FASL" "SB-BIGNUM" "SB-LOCKLESS" "SB-KERNEL" "SB-PCL" "SB-THREAD" "SB-DEBUG" "SB-DI" "SB-FORMAT" "SB
-PROFILE" "SB-INT" "SB-SYS" "SB-EVAL" "SB-WALKER" "SB-ALIEN" "SB-UNIX" "SB-UNICODE" "SB-IMPL" "SB-APROF" "SB-LOOP" "SB-ASSEM" "SB-C" "SB-EXT" "SB-INTROSPECT"
)) ("dohash" 1 ("SB-X86-64-ASM" "SB-DISASSEM" "SB-RBTREE" "SB-VM" "SB-GRAY" "SB-REGALLOC" "SB-PRETTY" "SB-CLTL2" "SB-FASL" "SB-BIGNUM" "SB-LOCKLESS" "SB-KERN
EL" "SB-PCL" "SB-THREAD" "SB-DEBUG" "SB-DI" "SB-FORMAT" "SB-PROFILE" "SB-INT" "SB-SYS" "SB-EVAL" "SB-WALKER" "SB-ALIEN" "SB-UNIX" "SB-UNICODE" "SB-IMPL" "SB-
APROF" "SB-LOOP" "SB-ASSEM" "SB-C" "SB-EXT" "SB-INTROSPECT")) ("define-function-name-syntax" 2 ("SB-X86-64-ASM" "SB-DISASSEM" "SB-RBTREE" "SB-VM" "SB-GRAY" "
SB-REGALLOC" "SB-PRETTY" "SB-CLTL2" "SB-FASL" "SB-BIGNUM" "SB-LOCKLESS" "SB-KERNEL" "SB-PCL" "SB-THREAD" "SB-DEBUG" "SB-DI" "SB-FORMAT" "SB-PROFILE" "SB-INT"
 "SB-SYS" "SB-EVAL" "SB-WALKER" "SB-ALIEN" "SB-UNIX" "SB-UNICODE" "SB-IMPL" "SB-APROF" "SB-LOOP" "SB-ASSEM" "SB-C" "SB-EXT" "SB-INTROSPECT")) ("prepare-for-f
ast-read-char" 1 ("SB-X86-64-ASM" "SB-DISASSEM" "SB-RBTREE" "SB-VM" "SB-GRAY" "SB-REGALLOC" "SB-PRETTY" "SB-CLTL2" "SB-FASL" "SB-BIGNUM" "SB-LOCKLESS" "SB-KE
RNEL" "SB-PCL" "SB-THREAD" "SB-DEBUG" "SB-DI" "SB-FORMAT" "SB-PROFILE" "SB-INT" "SB-SYS" "SB-EVAL" "SB-WALKER" "SB-ALIEN" "SB-UNIX" "SB-UNICODE" "SB-IMPL" "S
B-APROF" "SB-LOOP" "SB-ASSEM" "SB-C" "SB-EXT" "SB-INTROSPECT")) ("with-unique-names" 1 ("SB-X86-64-ASM" "SB-DISASSEM" "SB-RBTREE" "SB-VM" "SB-GRAY" "SB-REGAL
LOC" "SB-PRETTY" "SB-CLTL2" "SB-FASL" "SB-BIGNUM" "SB-LOCKLESS" "SB-KERNEL" "SB-PCL" "SB-THREAD" "SB-DEBUG" "SB-DI" "SB-FORMAT" "SB-PROFILE" "SB-INT" "SB-SYS
" "SB-EVAL" "SB-WALKER" "SB-ALIEN" "SB-UNIX" "SB-UNICODE" "SB-IMPL" "SB-APROF" "SB-LOOP" "SB-ASSEM" "SB-C" "SB-EXT" "SB-INTROSPECT")) ("with-float-traps-mask
ed" 1 ("SB-X86-64-ASM" "SB-DISASSEM" "SB-RBTREE" "SB-VM" "SB-GRAY" "SB-REGALLOC" "SB-PRETTY" "SB-CLTL2" "SB-FASL" "SB-BIGNUM" "SB-LOCKLESS" "SB-KERNEL" "SB-P
CL" "SB-THREAD" "SB-DEBUG" "SB-DI" "SB-FORMAT" "SB-PROFILE" "SB-INT" "SB-SYS" "SB-EVAL" "SB-WALKER" "SB-ALIEN" "SB-UNIX" "SB-UNICODE" "SB-IMPL" "SB-APROF" "S
B-LOOP" "SB-ASSEM" "SB-C" "SB-EXT" "SB-INTROSPECT")) ("define-deprecated-function" 5 ("SB-X86-64-ASM" "SB-DISASSEM" "SB-RBTREE" "SB-VM" "SB-GRAY" "SB-REGALLO
C" "SB-PRETTY" "SB-CLTL2" "SB-FASL" "SB-BIGNUM" "SB-LOCKLESS" "SB-KERNEL" "SB-PCL" "SB-THREAD" "SB-DEBUG" "SB-DI" "SB-FORMAT" "SB-PROFILE" "SB-INT" "SB-SYS" 
"SB-EVAL" "SB-WALKER" "SB-ALIEN" "SB-UNIX" "SB-UNICODE" "SB-IMPL" "SB-APROF" "SB-LOOP" "SB-ASSEM" "SB-C" "SB-EXT" "SB-INTROSPECT")) ("dx-flet" 1 ("SB-X86-64-
ASM" "SB-DISASSEM" "SB-RBTREE" "SB-VM" "SB-GRAY" "SB-REGALLOC" "SB-PRETTY" "SB-CLTL2" "SB-FASL" "SB-BIGNUM" "SB-LOCKLESS" "SB-KERNEL" "SB-PCL" "SB-THREAD" "S
B-DEBUG" "SB-DI" "SB-FORMAT" "SB-PROFILE" "SB-INT" "SB-SYS" "SB-EVAL" "SB-WALKER" "SB-ALIEN" "SB-UNIX" "SB-UNICODE" "SB-IMPL" "SB-APROF" "SB-LOOP" "SB-ASSEM"
 "SB-C" "SB-EXT" "SB-INTROSPECT")) ("once-only" 1 ("SB-X86-64-ASM" "SB-DISASSEM" "SB-RBTREE" "SB-VM" "SB-GRAY" "SB-REGALLOC" "SB-PRETTY" "SB-CLTL2" "SB-FASL"
 "SB-BIGNUM" "SB-LOCKLESS" "SB-KERNEL" "SB-PCL" "SB-THREAD" "SB-DEBUG" "SB-DI" "SB-FORMAT" "SB-PROFILE" "SB-INT" "SB-SYS" "SB-EVAL" "SB-WALKER" "SB-ALIEN" "S
B-UNIX" "SB-UNICODE" "SB-IMPL" "SB-APROF" "SB-LOOP" "SB-ASSEM" "SB-C" "SB-EXT" "SB-INTROSPECT")) ("do-sset-elements" 1 ("SB-X86-64-ASM" "SB-DISASSEM" "SB-RBT
REE" "SB-VM" "SB-GRAY" "SB-REGALLOC" "SB-PRETTY" "SB-CLTL2" "SB-FASL" "SB-BIGNUM" "SB-LOCKLESS" "SB-KERNEL" "SB-PCL" "SB-THREAD" "SB-DEBUG" "SB-DI" "SB-FORMA
T" "SB-PROFILE" "SB-INT" "SB-SYS" "SB-EVAL" "SB-WALKER" "SB-ALIEN" "SB-UNIX" "SB-UNICODE" "SB-IMPL" "SB-APROF" "SB-LOOP" "SB-ASSEM" "SB-C" "SB-EXT" "SB-INTRO
SPECT")) ("do-asdf-cache" 1 ("ASDF/LISP-ACTION" "ASDF/INTERFACE" "ASDF/SYSTEM-REGISTRY" "ASDF/PARSE-DEFSYSTEM" "ASDF/PACKAGE-INFERRED-SYSTEM" "ASDF/PLAN" "AS
DF/OPERATE" "ASDF/ACTION" "ASDF/SESSION" "ASDF/FIND-SYSTEM" "ASDF/OPERATION" "ASDF/SYSTEM" "ASDF/BACKWARD-INTERFACE" "ASDF/FORCING" "ASDF/COMPONENT" "ASDF/FI
ND-COMPONENT")) ("with-asdf-session" 1 ("ASDF/LISP-ACTION" "ASDF/INTERFACE" "ASDF/SYSTEM-REGISTRY" "ASDF/PARSE-DEFSYSTEM" "ASDF/PACKAGE-INFERRED-SYSTEM" "ASD
F/PLAN" "ASDF/OPERATE" "ASDF/ACTION" "ASDF/SESSION" "ASDF/FIND-SYSTEM" "ASDF/OPERATION" "ASDF/SYSTEM" "ASDF/BACKWARD-INTERFACE" "ASDF/FORCING" "ASDF/COMPONEN
T" "ASDF/FIND-COMPONENT")) ("while-visiting-action" 1 ("ASDF/BUNDLE" "ASDF/LISP-ACTION" "ASDF/INTERFACE" "ASDF/PARSE-DEFSYSTEM" "ASDF/PLAN" "ASDF/OPERATE" "A
SDF/CONCATENATE-SOURCE" "ASDF/ACTION" "ASDF/FIND-SYSTEM" "ASDF/BACKWARD-INTERFACE")) ("dosequence" 1 ("SB-SEQUENCE")) ("with-sequence-iterator-functions" 2 (
"SB-SEQUENCE")) ("with-sequence-iterator" 2 ("SB-SEQUENCE")) ("with-asdf-deprecation" 1 ("ASDF/BUNDLE" "ASDF/FOOTER" "ASDF/LISP-ACTION" "ASDF/INTERFACE" "ASD
F/SYSTEM-REGISTRY" "ASDF/PARSE-DEFSYSTEM" "ASDF/PACKAGE-INFERRED-SYSTEM" "ASDF/OUTPUT-TRANSLATIONS" "ASDF/PLAN" "ASDF/OPERATE" "ASDF/CONCATENATE-SOURCE" "ASD
F/UPGRADE" "ASDF/ACTION" "ASDF/SESSION" "ASDF/FIND-SYSTEM" "ASDF/BACKWARD-INTERNALS" "ASDF/OPERATION" "ASDF/SYSTEM" "ASDF/BACKWARD-INTERFACE" "ASDF/FORCING" 
"ASDF/SOURCE-REGISTRY" "ASDF/COMPONENT" "ASDF/FIND-COMPONENT")) ("when-upgrading" 1 ("ASDF/BUNDLE" "ASDF/FOOTER" "ASDF/LISP-ACTION" "ASDF/INTERFACE" "ASDF/SY
STEM-REGISTRY" "ASDF/PARSE-DEFSYSTEM" "ASDF/PACKAGE-INFERRED-SYSTEM" "ASDF/OUTPUT-TRANSLATIONS" "ASDF/PLAN" "ASDF/OPERATE" "ASDF/CONCATENATE-SOURCE" "ASDF/UP
GRADE" "ASDF/ACTION" "ASDF/SESSION" "ASDF/FIND-SYSTEM" "ASDF/BACKWARD-INTERNALS" "ASDF/OPERATION" "ASDF/SYSTEM" "ASDF/BACKWARD-INTERFACE" "ASDF/FORCING" "ASD
F/SOURCE-REGISTRY" "ASDF/COMPONENT" "ASDF/FIND-COMPONENT")) ("with-slime-output-stream" 1 ("SWANK/GRAY")) ("expand-bind-defaults" 2 ("SB-FORMAT")) ("maybe-wi
th-pinned-objects" 2 ("SB-VM" "SB-REGALLOC" "SB-KERNEL" "SB-ALIEN-INTERNALS" "SB-ALIEN" "SB-C")) ("define-alien-type-translator" 2 ("SB-VM" "SB-REGALLOC" "SB
-KERNEL" "SB-ALIEN-INTERNALS" "SB-ALIEN" "SB-C")) ("do-debug-fun-blocks" 1 ("SB-DISASSEM" "SB-DEBUG" "SB-DI")) ("do-debug-fun-vars" 1 ("SB-DISASSEM" "SB-DEBU
G" "SB-DI")) ("do-debug-block-locations" 1 ("SB-DISASSEM" "SB-DEBUG" "SB-DI")) ("with-debug-io-syntax" 1 ("SB-DEBUG")) ("with-struct" 2 ("SWANK/SBCL" "SWANK/
BACKEND" "SWANK/GRAY" "SWANK")) ("with-compilation-hooks" 1 ("SWANK/SBCL" "SWANK/BACKEND" "SWANK/GRAY" "SWANK")) ("with-collected-macro-forms" 2 ("SWANK/SBCL
" "SWANK/BACKEND" "SWANK/GRAY" "SWANK")) ("converting-errors-to-error-location" 0 ("SWANK/SBCL" "SWANK/BACKEND" "SWANK/GRAY" "SWANK")) ("when-let" 1 ("SWANK/
SBCL" "SWANK/BACKEND" "SWANK/GRAY" "SWANK")) ("with-session-lock" 1 ("SB-THREAD")) ("with-new-session" 1 ("SB-THREAD")) ("with-spinlock" 1 ("SB-THREAD")) ("w
ith-recursive-lock" 1 ("SB-THREAD")) ("barrier" 1 ("SB-THREAD")) ("with-deathlok" 1 ("SB-THREAD")) ("with-mutex" 1 ("SB-THREAD")) ("%with-cas-lock" 1 ("SB-TH
READ")) ("nlx-protect-futex" 1 ("SB-THREAD")) ("with-recursive-spinlock" 1 ("SB-THREAD")) ("with-connection" 1 ("QL-NETWORK" "QL-HTTP")) ("with-consistent-di
sts" 0 ("QUICKLISP-CLIENT" "QL-DIST-USER" "QL-DIST" "QL-BUNDLE")) ("destructure-line" 2 ("QL-DIST")) ("for-each-line" 1 ("QL-DIST")) ("simple-lexical-method-
functions" 1 ("SB-PCL")) ("bind-args" 1 ("SB-PCL")) ("bind-simple-lexical-method-functions" 1 ("SB-PCL")) ("with-type-checked" 1 ("SB-PCL")) ("fast-lexical-m
ethod-functions" 1 ("SB-PCL")) ("pv-binding" 1 ("SB-PCL")) ("pv-binding1" 1 ("SB-PCL")) ("bind-fast-lexical-method-functions" 1 ("SB-PCL")) ("if-let" 1 ("ASD
F/BUNDLE" "UIOP/IMAGE" "ASDF/FOOTER" "ASDF/LISP-ACTION" "UIOP/PATHNAME" "ASDF/INTERFACE" "UIOP/BACKWARD-DRIVER" "UIOP/STREAM" "ASDF/USER" "UIOP/OS" "ASDF/SYS
TEM-REGISTRY" "UIOP/DRIVER" "ASDF/PARSE-DEFSYSTEM" "ASDF/PACKAGE-INFERRED-SYSTEM" "ASDF/OUTPUT-TRANSLATIONS" "ASDF/PLAN" "ASDF/OPERATE" "ASDF/CONCATENATE-SOU
RCE" "UIOP/UTILITY" "ASDF/UPGRADE" "ASDF/ACTION" "ASDF/SESSION" "ASDF/FIND-SYSTEM" "ASDF/BACKWARD-INTERNALS" "ASDF/OPERATION" "ASDF/SYSTEM" "UIOP/FILESYSTEM"
 "UIOP/RUN-PROGRAM" "UIOP/CONFIGURATION" "ASDF/BACKWARD-INTERFACE" "UIOP/LAUNCH-PROGRAM" "UIOP/VERSION" "ASDF/FORCING" "UIOP/LISP-BUILD" "ASDF/SOURCE-REGISTR
Y" "ASDF/COMPONENT" "ASDF/FIND-COMPONENT")) ("with-upgradability" 1 ("ASDF/BUNDLE" "UIOP/IMAGE" "ASDF/FOOTER" "ASDF/LISP-ACTION" "UIOP/PATHNAME" "ASDF/INTERF
ACE" "UIOP/BACKWARD-DRIVER" "UIOP/STREAM" "ASDF/USER" "UIOP/OS" "ASDF/SYSTEM-REGISTRY" "UIOP/DRIVER" "ASDF/PARSE-DEFSYSTEM" "ASDF/PACKAGE-INFERRED-SYSTEM" "A
SDF/OUTPUT-TRANSLATIONS" "ASDF/PLAN" "ASDF/OPERATE" "ASDF/CONCATENATE-SOURCE" "UIOP/UTILITY" "ASDF/UPGRADE" "ASDF/ACTION" "ASDF/SESSION" "ASDF/FIND-SYSTEM" "
ASDF/BACKWARD-INTERNALS" "ASDF/OPERATION" "ASDF/SYSTEM" "UIOP/FILESYSTEM" "UIOP/RUN-PROGRAM" "UIOP/CONFIGURATION" "ASDF/BACKWARD-INTERFACE" "UIOP/LAUNCH-PROG
RAM" "UIOP/VERSION" "ASDF/FORCING" "UIOP/LISP-BUILD" "ASDF/SOURCE-REGISTRY" "ASDF/COMPONENT" "ASDF/FIND-COMPONENT")) ("with-muffled-loader-conditions" 1 ("AS
DF/BUNDLE" "ASDF/FOOTER" "ASDF/LISP-ACTION" "ASDF/INTERFACE" "UIOP/BACKWARD-DRIVER" "ASDF/USER" "ASDF/SYSTEM-REGISTRY" "UIOP/DRIVER" "ASDF/PARSE-DEFSYSTEM" "
ASDF/PACKAGE-INFERRED-SYSTEM" "ASDF/OUTPUT-TRANSLATIONS" "ASDF/PLAN" "ASDF/OPERATE" "ASDF/CONCATENATE-SOURCE" "ASDF/UPGRADE" "ASDF/ACTION" "ASDF/SESSION" "AS
DF/FIND-SYSTEM" "ASDF/BACKWARD-INTERNALS" "ASDF/OPERATION" "ASDF/SYSTEM" "UIOP/CONFIGURATION" "ASDF/BACKWARD-INTERFACE" "ASDF/FORCING" "UIOP/LISP-BUILD" "ASD
F/SOURCE-REGISTRY" "ASDF/COMPONENT" "ASDF/FIND-COMPONENT")) ("with-current-directory" 1 ("ASDF/BUNDLE" "ASDF/FOOTER" "ASDF/LISP-ACTION" "ASDF/INTERFACE" "UIO
P/STREAM" "ASDF/USER" "ASDF/SYSTEM-REGISTRY" "UIOP/DRIVER" "ASDF/PARSE-DEFSYSTEM" "ASDF/PACKAGE-INFERRED-SYSTEM" "ASDF/OUTPUT-TRANSLATIONS" "ASDF/PLAN" "ASDF
/OPERATE" "ASDF/CONCATENATE-SOURCE" "ASDF/UPGRADE" "ASDF/ACTION" "ASDF/SESSION" "ASDF/FIND-SYSTEM" "ASDF/BACKWARD-INTERNALS" "ASDF/OPERATION" "ASDF/SYSTEM" "
UIOP/FILESYSTEM" "UIOP/RUN-PROGRAM" "UIOP/CONFIGURATION" "ASDF/BACKWARD-INTERFACE" "UIOP/LAUNCH-PROGRAM" "ASDF/FORCING" "UIOP/LISP-BUILD" "ASDF/SOURCE-REGIST
RY" "ASDF/COMPONENT" "ASDF/FIND-COMPONENT")) ("while-collecting" 1 ("ASDF/BUNDLE" "UIOP/IMAGE" "ASDF/FOOTER" "ASDF/LISP-ACTION" "UIOP/PATHNAME" "ASDF/INTERFA
CE" "UIOP/BACKWARD-DRIVER" "UIOP/STREAM" "ASDF/USER" "UIOP/OS" "ASDF/SYSTEM-REGISTRY" "UIOP/DRIVER" "ASDF/PARSE-DEFSYSTEM" "ASDF/PACKAGE-INFERRED-SYSTEM" "AS
DF/OUTPUT-TRANSLATIONS" "ASDF/PLAN" "ASDF/OPERATE" "ASDF/CONCATENATE-SOURCE" "UIOP/UTILITY" "ASDF/UPGRADE" "ASDF/ACTION" "ASDF/SESSION" "ASDF/FIND-SYSTEM" "A
SDF/BACKWARD-INTERNALS" "ASDF/OPERATION" "ASDF/SYSTEM" "UIOP/FILESYSTEM" "UIOP/RUN-PROGRAM" "UIOP/CONFIGURATION" "ASDF/BACKWARD-INTERFACE" "UIOP/LAUNCH-PROGR
AM" "UIOP/VERSION" "ASDF/FORCING" "UIOP/LISP-BUILD" "ASDF/SOURCE-REGISTRY" "ASDF/COMPONENT" "ASDF/FIND-COMPONENT")) ("with-muffled-conditions" 1 ("ASDF/BUNDL
E" "UIOP/IMAGE" "ASDF/FOOTER" "ASDF/LISP-ACTION" "UIOP/PATHNAME" "ASDF/INTERFACE" "UIOP/BACKWARD-DRIVER" "UIOP/STREAM" "ASDF/USER" "UIOP/OS" "ASDF/SYSTEM-REG
ISTRY" "UIOP/DRIVER" "ASDF/PARSE-DEFSYSTEM" "ASDF/PACKAGE-INFERRED-SYSTEM" "ASDF/OUTPUT-TRANSLATIONS" "ASDF/PLAN" "ASDF/OPERATE" "ASDF/CONCATENATE-SOURCE" "U
IOP/UTILITY" "ASDF/UPGRADE" "ASDF/ACTION" "ASDF/SESSION" "ASDF/FIND-SYSTEM" "ASDF/BACKWARD-INTERNALS" "ASDF/OPERATION" "ASDF/SYSTEM" "UIOP/FILESYSTEM" "UIOP/
RUN-PROGRAM" "UIOP/CONFIGURATION" "ASDF/BACKWARD-INTERFACE" "UIOP/LAUNCH-PROGRAM" "UIOP/VERSION" "ASDF/FORCING" "UIOP/LISP-BUILD" "ASDF/SOURCE-REGISTRY" "ASD
F/COMPONENT" "ASDF/FIND-COMPONENT")) ("with-saved-deferred-warnings" 1 ("ASDF/BUNDLE" "ASDF/FOOTER" "ASDF/LISP-ACTION" "ASDF/INTERFACE" "UIOP/BACKWARD-DRIVER
" "ASDF/USER" "ASDF/SYSTEM-REGISTRY" "UIOP/DRIVER" "ASDF/PARSE-DEFSYSTEM" "ASDF/PACKAGE-INFERRED-SYSTEM" "ASDF/OUTPUT-TRANSLATIONS" "ASDF/PLAN" "ASDF/OPERATE
" "ASDF/CONCATENATE-SOURCE" "ASDF/UPGRADE" "ASDF/ACTION" "ASDF/SESSION" "ASDF/FIND-SYSTEM" "ASDF/BACKWARD-INTERNALS" "ASDF/OPERATION" "ASDF/SYSTEM" "UIOP/CON
FIGURATION" "ASDF/BACKWARD-INTERFACE" "ASDF/FORCING" "UIOP/LISP-BUILD" "ASDF/SOURCE-REGISTRY" "ASDF/COMPONENT" "ASDF/FIND-COMPONENT")) ("with-muffled-compile
r-conditions" 1 ("ASDF/BUNDLE" "ASDF/FOOTER" "ASDF/LISP-ACTION" "ASDF/INTERFACE" "UIOP/BACKWARD-DRIVER" "ASDF/USER" "ASDF/SYSTEM-REGISTRY" "UIOP/DRIVER" "ASD
F/PARSE-DEFSYSTEM" "ASDF/PACKAGE-INFERRED-SYSTEM" "ASDF/OUTPUT-TRANSLATIONS" "ASDF/PLAN" "ASDF/OPERATE" "ASDF/CONCATENATE-SOURCE" "ASDF/UPGRADE" "ASDF/ACTION
" "ASDF/SESSION" "ASDF/FIND-SYSTEM" "ASDF/BACKWARD-INTERNALS" "ASDF/OPERATION" "ASDF/SYSTEM" "UIOP/CONFIGURATION" "ASDF/BACKWARD-INTERFACE" "ASDF/FORCING" "U
IOP/LISP-BUILD" "ASDF/SOURCE-REGISTRY" "ASDF/COMPONENT" "ASDF/FIND-COMPONENT")) ("with-deprecation" 1 ("ASDF/BUNDLE" "ASDF/FOOTER" "ASDF/LISP-ACTION" "ASDF/I
NTERFACE" "UIOP/BACKWARD-DRIVER" "ASDF/USER" "ASDF/SYSTEM-REGISTRY" "UIOP/DRIVER" "ASDF/PARSE-DEFSYSTEM" "ASDF/PACKAGE-INFERRED-SYSTEM" "ASDF/OUTPUT-TRANSLAT
IONS" "ASDF/PLAN" "ASDF/OPERATE" "ASDF/CONCATENATE-SOURCE" "ASDF/UPGRADE" "ASDF/ACTION" "ASDF/SESSION" "ASDF/FIND-SYSTEM" "ASDF/BACKWARD-INTERNALS" "ASDF/OPE
RATION" "ASDF/SYSTEM" "UIOP/RUN-PROGRAM" "ASDF/BACKWARD-INTERFACE" "UIOP/VERSION" "ASDF/FORCING" "ASDF/SOURCE-REGISTRY" "ASDF/COMPONENT" "ASDF/FIND-COMPONENT
")) ("with-optimization-settings" 1 ("ASDF/BUNDLE" "ASDF/FOOTER" "ASDF/LISP-ACTION" "ASDF/INTERFACE" "UIOP/BACKWARD-DRIVER" "ASDF/USER" "ASDF/SYSTEM-REGISTRY
" "UIOP/DRIVER" "ASDF/PARSE-DEFSYSTEM" "ASDF/PACKAGE-INFERRED-SYSTEM" "ASDF/OUTPUT-TRANSLATIONS" "ASDF/PLAN" "ASDF/OPERATE" "ASDF/CONCATENATE-SOURCE" "ASDF/U
PGRADE" "ASDF/ACTION" "ASDF/SESSION" "ASDF/FIND-SYSTEM" "ASDF/BACKWARD-INTERNALS" "ASDF/OPERATION" "ASDF/SYSTEM" "UIOP/CONFIGURATION" "ASDF/BACKWARD-INTERFAC
E" "ASDF/FORCING" "UIOP/LISP-BUILD" "ASDF/SOURCE-REGISTRY" "ASDF/COMPONENT" "ASDF/FIND-COMPONENT")) ("defimplementation" 2 ("SWANK/SBCL" "SWANK/SOURCE-FILE-C
ACHE" "SWANK/BACKEND" "SWANK/GRAY" "SWANK")) ("definterface" 2 ("QL-IMPL" "QL-NETWORK" "QL-IMPL-UTIL")) ("defimplementation" 2 ("QL-IMPL" "QL-NETWORK" "QL-IM
PL-UTIL")) ("descend-into" 1 ("SB-X86-64-ASM" "SB-DISASSEM" "SB-VM" "SB-GRAY" "SB-REGALLOC" "SB-PRETTY" "SB-CLTL2" "SB-FASL" "SB-BIGNUM" "SB-LOCKLESS" "SB-KE
RNEL" "SB-PCL" "SB-THREAD" "SB-DEBUG" "SB-DI" "SB-FORMAT" "SB-PROFILE" "SB-EVAL" "SB-IMPL" "SB-APROF" "SB-LOOP" "SB-C" "SB-INTROSPECT")) ("do-instance-tagged
-slot" 1 ("SB-X86-64-ASM" "SB-DISASSEM" "SB-VM" "SB-GRAY" "SB-REGALLOC" "SB-PRETTY" "SB-CLTL2" "SB-FASL" "SB-BIGNUM" "SB-LOCKLESS" "SB-KERNEL" "SB-PCL" "SB-T
HREAD" "SB-DEBUG" "SB-DI" "SB-FORMAT" "SB-PROFILE" "SB-EVAL" "SB-IMPL" "SB-APROF" "SB-LOOP" "SB-C" "SB-INTROSPECT")) ("do-rest-arg" 1 ("SB-X86-64-ASM" "SB-DI
SASSEM" "SB-VM" "SB-GRAY" "SB-REGALLOC" "SB-PRETTY" "SB-CLTL2" "SB-FASL" "SB-BIGNUM" "SB-LOCKLESS" "SB-KERNEL" "SB-PCL" "SB-THREAD" "SB-DEBUG" "SB-DI" "SB-FO
RMAT" "SB-PROFILE" "SB-EVAL" "SB-IMPL" "SB-APROF" "SB-LOOP" "SB-C" "SB-INTROSPECT")) ("%with-output-to-string" 1 ("SB-X86-64-ASM" "SB-DISASSEM" "SB-VM" "SB-G
RAY" "SB-REGALLOC" "SB-PRETTY" "SB-CLTL2" "SB-FASL" "SB-BIGNUM" "SB-LOCKLESS" "SB-KERNEL" "SB-PCL" "SB-THREAD" "SB-DEBUG" "SB-DI" "SB-FORMAT" "SB-PROFILE" "S
B-EVAL" "SB-IMPL" "SB-APROF" "SB-LOOP" "SB-C" "SB-INTROSPECT")) ("with-single-package-locked-error" 1 ("SB-X86-64-ASM" "SB-DISASSEM" "SB-VM" "SB-GRAY" "SB-RE
GALLOC" "SB-PRETTY" "SB-CLTL2" "SB-FASL" "SB-BIGNUM" "SB-LOCKLESS" "SB-KERNEL" "SB-PCL" "SB-THREAD" "SB-DEBUG" "SB-DI" "SB-FORMAT" "SB-PROFILE" "SB-EVAL" "SB
-IMPL" "SB-APROF" "SB-LOOP" "SB-C" "SB-INTROSPECT")) ("with-circularity-detection" 1 ("SB-X86-64-ASM" "SB-DISASSEM" "SB-VM" "SB-GRAY" "SB-REGALLOC" "SB-PRETT
Y" "SB-CLTL2" "SB-FASL" "SB-BIGNUM" "SB-LOCKLESS" "SB-KERNEL" "SB-PCL" "SB-THREAD" "SB-DEBUG" "SB-DI" "SB-FORMAT" "SB-PROFILE" "SB-EVAL" "SB-IMPL" "SB-APROF"
 "SB-LOOP" "SB-C" "SB-INTROSPECT")) ("do-closure-values" 1 ("SB-X86-64-ASM" "SB-DISASSEM" "SB-VM" "SB-GRAY" "SB-REGALLOC" "SB-PRETTY" "SB-CLTL2" "SB-FASL" "S
B-BIGNUM" "SB-LOCKLESS" "SB-KERNEL" "SB-PCL" "SB-THREAD" "SB-DEBUG" "SB-DI" "SB-FORMAT" "SB-PROFILE" "SB-EVAL" "SB-IMPL" "SB-APROF" "SB-LOOP" "SB-C" "SB-INTR
OSPECT")) ("with-world-lock" 1 ("SB-X86-64-ASM" "SB-DISASSEM" "SB-VM" "SB-GRAY" "SB-REGALLOC" "SB-PRETTY" "SB-CLTL2" "SB-FASL" "SB-BIGNUM" "SB-LOCKLESS" "SB-
KERNEL" "SB-PCL" "SB-THREAD" "SB-DEBUG" "SB-DI" "SB-FORMAT" "SB-PROFILE" "SB-EVAL" "SB-IMPL" "SB-APROF" "SB-LOOP" "SB-C" "SB-INTROSPECT")) ("number-dispatch"
 1 ("SB-KERNEL")) ("do-lockfree-list" 1 ("SB-LOCKLESS")) ("with-sockaddr-un" 2 ("SB-BSD-SOCKETS-INTERNAL")) ("with-sockaddr-in6" 2 ("SB-BSD-SOCKETS-INTERNAL"
)) ("with-in6-addr" 2 ("SB-BSD-SOCKETS-INTERNAL")) ("with-array-data" 1 ("SB-X86-64-ASM" "SB-DISASSEM" "SB-VM" "SB-GRAY" "SB-REGALLOC" "SB-PRETTY" "SB-CLTL2"
 "SB-FASL" "SB-BIGNUM" "SB-BSD-SOCKETS-INTERNAL" "SB-LOCKLESS" "SB-KERNEL" "SB-PCL" "SB-THREAD" "SB-DEBUG" "SB-DI" "SB-FORMAT" "SB-PROFILE" "SB-EVAL" "SB-IMP
L" "SB-APROF" "SB-LOOP" "SB-C" "SB-INTROSPECT")) ("with-in-addr" 2 ("SB-BSD-SOCKETS-INTERNAL")) ("with-sockaddr-un-abstract" 2 ("SB-BSD-SOCKETS-INTERNAL")) (
"with-hostent" 2 ("SB-BSD-SOCKETS-INTERNAL")) ("with-sockaddr-in" 2 ("SB-BSD-SOCKETS-INTERNAL")) ("with-protoent" 2 ("SB-BSD-SOCKETS-INTERNAL")) ("with-addri
nfo" 2 ("SB-BSD-SOCKETS-INTERNAL")) ("with-compiler-policy" 1 ("SWANK/SBCL")) ("with-debootstrapping" 0 ("SWANK/SBCL")) ("with-definition-source" 2 ("SWANK/S
BCL")) ("with-staging-pathname" 1 ("ASDF/BUNDLE" "UIOP/IMAGE" "ASDF/FOOTER" "ASDF/LISP-ACTION" "ASDF/INTERFACE" "UIOP/BACKWARD-DRIVER" "UIOP/STREAM" "ASDF/US
ER" "ASDF/SYSTEM-REGISTRY" "UIOP/DRIVER" "ASDF/PARSE-DEFSYSTEM" "ASDF/PACKAGE-INFERRED-SYSTEM" "ASDF/OUTPUT-TRANSLATIONS" "ASDF/PLAN" "ASDF/OPERATE" "ASDF/CO
NCATENATE-SOURCE" "ASDF/UPGRADE" "ASDF/ACTION" "ASDF/SESSION" "ASDF/FIND-SYSTEM" "ASDF/BACKWARD-INTERNALS" "ASDF/OPERATION" "ASDF/SYSTEM" "UIOP/RUN-PROGRAM" 
"UIOP/CONFIGURATION" "ASDF/BACKWARD-INTERFACE" "UIOP/LAUNCH-PROGRAM" "ASDF/FORCING" "UIOP/LISP-BUILD" "ASDF/SOURCE-REGISTRY" "ASDF/COMPONENT" "ASDF/FIND-COMP
ONENT")) ("with-null-input" 1 ("ASDF/BUNDLE" "UIOP/IMAGE" "ASDF/FOOTER" "ASDF/LISP-ACTION" "ASDF/INTERFACE" "UIOP/BACKWARD-DRIVER" "UIOP/STREAM" "ASDF/USER" 
"ASDF/SYSTEM-REGISTRY" "UIOP/DRIVER" "ASDF/PARSE-DEFSYSTEM" "ASDF/PACKAGE-INFERRED-SYSTEM" "ASDF/OUTPUT-TRANSLATIONS" "ASDF/PLAN" "ASDF/OPERATE" "ASDF/CONCAT
ENATE-SOURCE" "ASDF/UPGRADE" "ASDF/ACTION" "ASDF/SESSION" "ASDF/FIND-SYSTEM" "ASDF/BACKWARD-INTERNALS" "ASDF/OPERATION" "ASDF/SYSTEM" "UIOP/RUN-PROGRAM" "UIO
P/CONFIGURATION" "ASDF/BACKWARD-INTERFACE" "UIOP/LAUNCH-PROGRAM" "ASDF/FORCING" "UIOP/LISP-BUILD" "ASDF/SOURCE-REGISTRY" "ASDF/COMPONENT" "ASDF/FIND-COMPONEN
T")) ("with-input" 1 ("ASDF/BUNDLE" "UIOP/IMAGE" "ASDF/FOOTER" "ASDF/LISP-ACTION" "ASDF/INTERFACE" "UIOP/BACKWARD-DRIVER" "UIOP/STREAM" "ASDF/USER" "ASDF/SYS
TEM-REGISTRY" "UIOP/DRIVER" "ASDF/PARSE-DEFSYSTEM" "ASDF/PACKAGE-INFERRED-SYSTEM" "ASDF/OUTPUT-TRANSLATIONS" "ASDF/PLAN" "ASDF/OPERATE" "ASDF/CONCATENATE-SOU
RCE" "ASDF/UPGRADE" "ASDF/ACTION" "ASDF/SESSION" "ASDF/FIND-SYSTEM" "ASDF/BACKWARD-INTERNALS" "ASDF/OPERATION" "ASDF/SYSTEM" "UIOP/RUN-PROGRAM" "UIOP/CONFIGU
RATION" "ASDF/BACKWARD-INTERFACE" "UIOP/LAUNCH-PROGRAM" "ASDF/FORCING" "UIOP/LISP-BUILD" "ASDF/SOURCE-REGISTRY" "ASDF/COMPONENT" "ASDF/FIND-COMPONENT")) ("wi
th-temporary-file" 1 ("ASDF/BUNDLE" "UIOP/IMAGE" "ASDF/FOOTER" "ASDF/LISP-ACTION" "ASDF/INTERFACE" "UIOP/BACKWARD-DRIVER" "UIOP/STREAM" "ASDF/USER" "ASDF/SYS
TEM-REGISTRY" "UIOP/DRIVER" "ASDF/PARSE-DEFSYSTEM" "ASDF/PACKAGE-INFERRED-SYSTEM" "ASDF/OUTPUT-TRANSLATIONS" "ASDF/PLAN" "ASDF/OPERATE" "ASDF/CONCATENATE-SOU
RCE" "ASDF/UPGRADE" "ASDF/ACTION" "ASDF/SESSION" "ASDF/FIND-SYSTEM" "ASDF/BACKWARD-INTERNALS" "ASDF/OPERATION" "ASDF/SYSTEM" "UIOP/RUN-PROGRAM" "UIOP/CONFIGU
RATION" "ASDF/BACKWARD-INTERFACE" "UIOP/LAUNCH-PROGRAM" "ASDF/FORCING" "UIOP/LISP-BUILD" "ASDF/SOURCE-REGISTRY" "ASDF/COMPONENT" "ASDF/FIND-COMPONENT")) ("wi
th-null-output" 1 ("ASDF/BUNDLE" "UIOP/IMAGE" "ASDF/FOOTER" "ASDF/LISP-ACTION" "ASDF/INTERFACE" "UIOP/BACKWARD-DRIVER" "UIOP/STREAM" "ASDF/USER" "ASDF/SYSTEM
-REGISTRY" "UIOP/DRIVER" "ASDF/PARSE-DEFSYSTEM" "ASDF/PACKAGE-INFERRED-SYSTEM" "ASDF/OUTPUT-TRANSLATIONS" "ASDF/PLAN" "ASDF/OPERATE" "ASDF/CONCATENATE-SOURCE
" "ASDF/UPGRADE" "ASDF/ACTION" "ASDF/SESSION" "ASDF/FIND-SYSTEM" "ASDF/BACKWARD-INTERNALS" "ASDF/OPERATION" "ASDF/SYSTEM" "UIOP/RUN-PROGRAM" "UIOP/CONFIGURAT
ION" "ASDF/BACKWARD-INTERFACE" "UIOP/LAUNCH-PROGRAM" "ASDF/FORCING" "UIOP/LISP-BUILD" "ASDF/SOURCE-REGISTRY" "ASDF/COMPONENT" "ASDF/FIND-COMPONENT")) ("with-
safe-io-syntax" 1 ("ASDF/BUNDLE" "UIOP/IMAGE" "ASDF/FOOTER" "ASDF/LISP-ACTION" "ASDF/INTERFACE" "UIOP/BACKWARD-DRIVER" "UIOP/STREAM" "ASDF/USER" "ASDF/SYSTEM
-REGISTRY" "UIOP/DRIVER" "ASDF/PARSE-DEFSYSTEM" "ASDF/PACKAGE-INFERRED-SYSTEM" "ASDF/OUTPUT-TRANSLATIONS" "ASDF/PLAN" "ASDF/OPERATE" "ASDF/CONCATENATE-SOURCE
" "ASDF/UPGRADE" "ASDF/ACTION" "ASDF/SESSION" "ASDF/FIND-SYSTEM" "ASDF/BACKWARD-INTERNALS" "ASDF/OPERATION" "ASDF/SYSTEM" "UIOP/RUN-PROGRAM" "UIOP/CONFIGURAT
ION" "ASDF/BACKWARD-INTERFACE" "UIOP/LAUNCH-PROGRAM" "ASDF/FORCING" "UIOP/LISP-BUILD" "ASDF/SOURCE-REGISTRY" "ASDF/COMPONENT" "ASDF/FIND-COMPONENT")) ("with-
output-file" 1 ("ASDF/BUNDLE" "UIOP/IMAGE" "ASDF/FOOTER" "ASDF/LISP-ACTION" "ASDF/INTERFACE" "UIOP/BACKWARD-DRIVER" "UIOP/STREAM" "ASDF/USER" "ASDF/SYSTEM-RE
GISTRY" "UIOP/DRIVER" "ASDF/PARSE-DEFSYSTEM" "ASDF/PACKAGE-INFERRED-SYSTEM" "ASDF/OUTPUT-TRANSLATIONS" "ASDF/PLAN" "ASDF/OPERATE" "ASDF/CONCATENATE-SOURCE" "
ASDF/UPGRADE" "ASDF/ACTION" "ASDF/SESSION" "ASDF/FIND-SYSTEM" "ASDF/BACKWARD-INTERNALS" "ASDF/OPERATION" "ASDF/SYSTEM" "UIOP/RUN-PROGRAM" "UIOP/CONFIGURATION
" "ASDF/BACKWARD-INTERFACE" "UIOP/LAUNCH-PROGRAM" "ASDF/FORCING" "UIOP/LISP-BUILD" "ASDF/SOURCE-REGISTRY" "ASDF/COMPONENT" "ASDF/FIND-COMPONENT")) ("with-out
put" 1 ("ASDF/BUNDLE" "UIOP/IMAGE" "ASDF/FOOTER" "ASDF/LISP-ACTION" "ASDF/INTERFACE" "UIOP/BACKWARD-DRIVER" "UIOP/STREAM" "ASDF/USER" "ASDF/SYSTEM-REGISTRY" 
"UIOP/DRIVER" "ASDF/PARSE-DEFSYSTEM" "ASDF/PACKAGE-INFERRED-SYSTEM" "ASDF/OUTPUT-TRANSLATIONS" "ASDF/PLAN" "ASDF/OPERATE" "ASDF/CONCATENATE-SOURCE" "ASDF/UPG
RADE" "ASDF/ACTION" "ASDF/SESSION" "ASDF/FIND-SYSTEM" "ASDF/BACKWARD-INTERNALS" "ASDF/OPERATION" "ASDF/SYSTEM" "UIOP/RUN-PROGRAM" "UIOP/CONFIGURATION" "ASDF/
BACKWARD-INTERFACE" "UIOP/LAUNCH-PROGRAM" "ASDF/FORCING" "UIOP/LISP-BUILD" "ASDF/SOURCE-REGISTRY" "ASDF/COMPONENT" "ASDF/FIND-COMPONENT")) ("with-input-file"
 1 ("ASDF/BUNDLE" "UIOP/IMAGE" "ASDF/FOOTER" "ASDF/LISP-ACTION" "ASDF/INTERFACE" "UIOP/BACKWARD-DRIVER" "UIOP/STREAM" "ASDF/USER" "ASDF/SYSTEM-REGISTRY" "UIO
P/DRIVER" "ASDF/PARSE-DEFSYSTEM" "ASDF/PACKAGE-INFERRED-SYSTEM" "ASDF/OUTPUT-TRANSLATIONS" "ASDF/PLAN" "ASDF/OPERATE" "ASDF/CONCATENATE-SOURCE" "ASDF/UPGRADE
" "ASDF/ACTION" "ASDF/SESSION" "ASDF/FIND-SYSTEM" "ASDF/BACKWARD-INTERNALS" "ASDF/OPERATION" "ASDF/SYSTEM" "UIOP/RUN-PROGRAM" "UIOP/CONFIGURATION" "ASDF/BACK
WARD-INTERFACE" "UIOP/LAUNCH-PROGRAM" "ASDF/FORCING" "UIOP/LISP-BUILD" "ASDF/SOURCE-REGISTRY" "ASDF/COMPONENT" "ASDF/FIND-COMPONENT")) ("defsystem" 1 ("ASDF/
BUNDLE" "ASDF/INTERFACE" "ASDF/USER" "ASDF/PARSE-DEFSYSTEM" "ASDF/PACKAGE-INFERRED-SYSTEM" "ASDF/BACKWARD-INTERFACE")) ("with-dirent" 2 ("SB-POSIX")) ("with-
alien-flock" 2 ("SB-POSIX")) ("with-alien-termios" 2 ("SB-POSIX")) ("with-growing-c-string" 1 ("SB-POSIX")) ("string-dispatch" 2 ("SB-POSIX" "SB-IMPL")) ("wi
th-alien-timespec" 2 ("SB-POSIX")) ("define-entry-point" 2 ("SB-POSIX")) ("with-alien-stat" 2 ("SB-POSIX")) ("with-alien-group" 2 ("SB-POSIX")) ("with-alien-
timeval" 2 ("SB-POSIX")) ("define-designator" 3 ("SB-POSIX")) ("with-alien-utimbuf" 2 ("SB-POSIX")) ("with-alien-passwd" 2 ("SB-POSIX")) ("define-declaration
" 2 ("SB-CLTL2")) ("with-socket-addr" 2 ("SB-BSD-SOCKETS")) ("with-socket-fd-and-addr" 2 ("SB-BSD-SOCKETS")) ("syscall-error-case" 2 ("SB-BSD-SOCKETS")) ("ad
drinfo-error-case" 2 ("SB-BSD-SOCKETS")) ("socket-error-case" 2 ("SB-BSD-SOCKETS")) ("with-vector-sap" 1 ("SB-BSD-SOCKETS")) ("do-sc-locations" 1 ("SB-REGALL
OC" "SB-C")) ("do-target-tns" 1 ("SB-REGALLOC")) ("when-package-fishiness" 0 ("UIOP/PACKAGE")) ("with-enough-pathname" 1 ("ASDF/BUNDLE" "UIOP/IMAGE" "ASDF/FO
OTER" "ASDF/LISP-ACTION" "UIOP/PATHNAME" "ASDF/INTERFACE" "UIOP/BACKWARD-DRIVER" "UIOP/STREAM" "ASDF/USER" "ASDF/SYSTEM-REGISTRY" "UIOP/DRIVER" "ASDF/PARSE-D
EFSYSTEM" "ASDF/PACKAGE-INFERRED-SYSTEM" "ASDF/OUTPUT-TRANSLATIONS" "ASDF/PLAN" "ASDF/OPERATE" "ASDF/CONCATENATE-SOURCE" "ASDF/UPGRADE" "ASDF/ACTION" "ASDF/S
ESSION" "ASDF/FIND-SYSTEM" "ASDF/BACKWARD-INTERNALS" "ASDF/OPERATION" "ASDF/SYSTEM" "UIOP/FILESYSTEM" "UIOP/RUN-PROGRAM" "UIOP/CONFIGURATION" "ASDF/BACKWARD-
INTERFACE" "UIOP/LAUNCH-PROGRAM" "ASDF/FORCING" "UIOP/LISP-BUILD" "ASDF/SOURCE-REGISTRY" "ASDF/COMPONENT" "ASDF/FIND-COMPONENT")) ("with-pathname-defaults" 1
 ("ASDF/BUNDLE" "UIOP/IMAGE" "ASDF/FOOTER" "ASDF/LISP-ACTION" "UIOP/PATHNAME" "ASDF/INTERFACE" "UIOP/BACKWARD-DRIVER" "UIOP/STREAM" "ASDF/USER" "ASDF/SYSTEM-
REGISTRY" "UIOP/DRIVER" "ASDF/PARSE-DEFSYSTEM" "ASDF/PACKAGE-INFERRED-SYSTEM" "ASDF/OUTPUT-TRANSLATIONS" "ASDF/PLAN" "ASDF/OPERATE" "ASDF/CONCATENATE-SOURCE"
 "ASDF/UPGRADE" "ASDF/ACTION" "ASDF/SESSION" "ASDF/FIND-SYSTEM" "ASDF/BACKWARD-INTERNALS" "ASDF/OPERATION" "ASDF/SYSTEM" "UIOP/FILESYSTEM" "UIOP/RUN-PROGRAM"
 "UIOP/CONFIGURATION" "ASDF/BACKWARD-INTERFACE" "UIOP/LAUNCH-PROGRAM" "ASDF/FORCING" "UIOP/LISP-BUILD" "ASDF/SOURCE-REGISTRY" "ASDF/COMPONENT" "ASDF/FIND-COM
PONENT")) ("with-fatal-condition-handler" 1 ("ASDF/BUNDLE" "UIOP/IMAGE" "ASDF/FOOTER" "ASDF/LISP-ACTION" "ASDF/INTERFACE" "UIOP/BACKWARD-DRIVER" "ASDF/USER" 
"ASDF/SYSTEM-REGISTRY" "UIOP/DRIVER" "ASDF/PARSE-DEFSYSTEM" "ASDF/PACKAGE-INFERRED-SYSTEM" "ASDF/OUTPUT-TRANSLATIONS" "ASDF/PLAN" "ASDF/OPERATE" "ASDF/CONCAT
ENATE-SOURCE" "ASDF/UPGRADE" "ASDF/ACTION" "ASDF/SESSION" "ASDF/FIND-SYSTEM" "ASDF/BACKWARD-INTERNALS" "ASDF/OPERATION" "ASDF/SYSTEM" "UIOP/CONFIGURATION" "A
SDF/BACKWARD-INTERFACE" "ASDF/FORCING" "UIOP/LISP-BUILD" "ASDF/SOURCE-REGISTRY" "ASDF/COMPONENT" "ASDF/FIND-COMPONENT"))))
encode-message
dispatch-event: (:RETURN #<SB-THREAD:THREAD "worker" FINISHED values: T {1001E03823}> (:OK ("SWANK-FUZZY" "SWANK-ARGLISTS" "SWANK-C-P-C" "SWANK-FANCY-INSPECT
OR" "SWANK-UTIL" "SWANK-PRESENTATIONS" "SWANK-REPL" "SWANK-PACKAGE-FU" "SWANK-ASDF" "SB-CLTL2" "SB-INTROSPECT" "SB-BSD-SOCKETS" "SB-POSIX" "ASDF" "asdf" "UIO
P" "uiop")) 2)
encode-message
decode-message
dispatch-event: (:EMACS-REX (SWANK:INIT-PRESENTATIONS) "COMMON-LISP-USER" T 3)
close-connection: end of file on #<SB-SYS:FD-STREAM for "socket 127.0.0.1:4006, peer: 127.0.0.1:52946" {1001C01EC3}> ...
;; swank:close-connection: end of file on #<SB-SYS:FD-STREAM for "socket 127.0.0.1:4006, peer: 127.0.0.1:52946" {1001C01EC3}>
; 
; compilation unit aborted
;   caught 1 fatal ERROR condition
close-connection end of file on #<SB-SYS:FD-STREAM for "socket 127.0.0.1:4006, peer: 127.0.0.1:52946" {1001C01EC3}> ... done.
```

@phmarek is the above of any help, or just a different way to collecting the same information that we gathered with wireshark?  I would really wish to understand what package is causing all this but I simply don't know how; if you have any hints on how to proceed just let me know -- I don't mind spending more time on this.

**Comment by phmarek** [comment]
The wireshark trace shows that the first request goes `vim → vlime → swank → vlime` but doesn't reach `vim` any more.
The vlime server log shows the same data.

The line 
```
dispatch-event: (:RETURN #<SB-THREAD:THREAD "worker" FINISHED values: T {1001E03823}> (:OK ("SWANK-FUZZY" … "SWANK-PRESENTATIONS" …)) 2)
```
indicates that `SWANK-PRESENTATIONS` is available; but the next call `(:EMACS-REX (SWANK:INIT-PRESENTATIONS) "COMMON-LISP-USER" T 3)` errors.

Reading the quoted line again, I can see that   "ASDF" "asdf" "UIOP" "uiop"` are duplicated in upper- and lowercase.

Does `nyxt` change the reader mode (http://www.lispworks.com/documentation/HyperSpec/Body/23_aba.htm)? If so, can you switch that back before `(ql:quickload :vlime)` etc., to see whether that is the reason?

I'm not sure that is enough, though - `ASDF` might not reload systems it believes to have loaded, so we might need to find the actual mismatch symbol names.

**Comment by iamFIREcracker** [comment]
> Reading the quoted line again, I can see that "ASDF" "asdf" "UIOP" "uiop"` are duplicated in upper- and lowercase.

I think we should not worry about this, as both the systems seems to be making themselves available via different names, _to satisfy more people_:

```
$ tail -n 5 "/usr/local/Cellar/sbcl/2.1.4/share/sbcl/contrib/asdf/uiop.lisp"

;; Provide both lowercase and uppercase, to satisfy more people.
(provide "uiop") (provide "UIOP")
(provide "UIOP")
(provide "uiop")
```

and:

```
$ tail -n 8 /usr/local/Cellar/sbcl/2.1.4/share/sbcl/contrib/asdf/asdf.lisp
  ;; Provide both lowercase and uppercase, to satisfy more people, especially LispWorks users.
  (provide "asdf") (provide "ASDF")

  ;; Finally, call a function that will cleanup in case this is an upgrade of an older ASDF.
  (cleanup-upgraded-asdf))

(when *load-verbose*
  (asdf-message ";; ASDF, version ~a~%" (asdf-version)))
```

**Comment by iamFIREcracker** [comment]
Alright, after applying the following patch I was then able to understand what was missing:

```diff
diff --git a/lisp/src/vlime-usocket.lisp b/lisp/src/vlime-usocket.lisp
index e060a9b..1c1ee24 100644
--- a/lisp/src/vlime-usocket.lisp
+++ b/lisp/src/vlime-usocket.lisp
@@ -105,7 +105,8 @@
                                     swank-stream)
                     (finish-output swank-stream))
                   (t (c)
-                     (swank/backend:send control-thread `(:client-data-error ,c)))))
+                     (let ((msg (format nil "~A" c)))
+                       (swank/backend:send control-thread `(:client-data-error ,msg))))))
 
               (:swank-data
                 (vom:debug "swank-data msg")
@@ -116,7 +117,8 @@
                                     client-stream)
                     (finish-output client-stream))
                   (t (c)
-                     (swank/backend:send control-thread `(:swank-data-error ,c)))))
+                     (let ((msg (format nil "~A" c)))
+                       (swank/backend:send control-thread `(:swank-data-error ,msg))))))
 
               ((:exit :client-eof :swank-eof :client-data-error :swank-data-error)
                 (vom:info "Control thread stopping: ~s" msg)
```

Let's start with the simple case:

```
(load "~/opt/vlime/lisp/load-vlime.lisp")
(vlime:main :port 7007 :start-swank nil :swank-port 4005)
```

While trying to connect`vim` to `vlime` I would get the following error message:

```
      <INFO> [21:56:44] vlime-usocket - Control thread stopping: (:SWANK-DATA-ERROR
                                                                  "Package CFFI-FEATURES does not exist.
```

I am not exactly sure why I would need that, but I `(ql:quickload "cffi")`'d it anyway, and after that I got:

```
      <INFO> [21:57:54] vlime-usocket - Control thread stopping: (:CLIENT-DATA-ERROR
                                                                  "The name \"SWANK-REPL\" does not designate any package.")
```

And that error message disappeared after I run `(swank-loader:init :load-contribs t)` -- and this seems to work with both local and remote images (to test a remote connection, I used `ngrok`).

So in summary, this is what enables me to connect to a remote Swank server:

```
(load "~/opt/vlime/lisp/load-vlime.lisp")
(ql:quickload "cffi") ;; Solves: Package CFFI-FEATURES does not exist
(swank-loader:init :load-contribs t) ;; Solves: The name SWANK-REPL does not designate any package
(vlime:main :port 7007 :start-swank nil :swank-port 4005)
```

Few open points:

1. Does the diff above make sense? I can create a PR if need be
2. What's the deal with "cffi"?  Why do I need to manually load it?
3. What's with that `(swank-loader:init :load-contribs t)`? Why do I need to manually run it while starting `vlime` without having it to create a Swank server?

Enough debugging for today -- hopefully this is helpful.

**Comment by HiPhish** [comment]
Thanks to the patch I have been able to narrow down the issue as well, but in my case it is the `CHIPZ` system that is missing. If I start the Vlime server as follows everything works:

```lisp
;;; Preparation, probably not needed if you start Vlime from its directory
(push #P"/home/hiphish/.local/share/nvim/site-packages/vlime/lisp/" ql:*local-project-directories*)
(ql:quickload :vlime)

;;; The missing system
(ql:quickload :chipz)

;;; Business as usual
(swank-loader:init :load-contribs t)
(vlime:main :port 7002 :start-swank nil :swank-port 4006)
```

Why do I need to load a system by hand? Is it a missing dependency?

**Comment by phmarek** [comment]
@iamFIREcracker :

> Does the diff above make sense? I can create a PR if need be

Yes, please.

> What's the deal with "cffi"? Why do I need to manually load it?

No idea. Would you please use `(sb-debug:print-backtrace)` or similar to find out what is trying to use `cffi`?

> What's with that (swank-loader:init :load-contribs t)? Why do I need to manually run it while starting vlime without having it to create a Swank server?

As your comment says, `vlime` requires `swank-repl` - which is a contrib. Just loading _all_ contribs resulted in problems in the past, though...
But you're right, loading the required contribs should be handled by `vlime`... Sadly I don't see a function to load individual contribs early or later on, and I didn't look whether `swank-loader:init` can be called multiple times with different contrib lists.

@HiPhish : I have no idea what is using `chipz` - would you please print a backtrace as well to see the source of the dependency?

Thanks for your help!

**Comment by HiPhish** [comment]
> would you please print a backtrace as well to see the source of the dependency?

Do you mean this?

```
CL-USER(4): (vlime:main :port 7002 :start-swank nil :swank-port 4006)

NIL
  <INFO> [21:09:31] vlime-usocket - Server created: (#(127 0 0 1) 7002)
CL-USER(5):   <INFO> [21:09:48] vlime-usocket - New client: #<USOCKET:STREAM-USOCKET {10046B2E83}>
  <INFO> [21:09:48] vlime-usocket - Control thread stopping: (:SWANK-DATA-ERROR
                                                              "Package CHIPZ-SYSTEM does not exist.

  Stream: #<dynamic-extent STRING-INPUT-STREAM (unavailable) from \"(:return...\">")

CL-USER(5): (sb-debug:print-backtrace)

Backtrace for: #<SB-THREAD:THREAD "main thread" RUNNING {1004AC81F3}>
0: (SB-INT:SIMPLE-EVAL-IN-LEXENV (PRINT-BACKTRACE) #<NULL-LEXENV>)
1: (EVAL (PRINT-BACKTRACE))
2: (INTERACTIVE-EVAL (PRINT-BACKTRACE) :EVAL NIL)
3: (SB-ACLREPL::REP-ONE)
4: (SB-ACLREPL::REPL :BREAK-LEVEL 0 :NOPRINT NIL :INSPECT NIL :CONTINUABLE NIL)
5: ((LAMBDA (SB-ACLREPL::NOPRINT) :IN SB-ACLREPL:MAKE-REPL-FUN) NIL)
6: ((LAMBDA NIL :IN SB-IMPL::TOPLEVEL-REPL))
7: (SB-IMPL::%WITH-REBOUND-IO-SYNTAX #<FUNCTION (LAMBDA NIL :IN SB-IMPL::TOPLEVEL-REPL) {1004F0AB2B}>)
8: (SB-IMPL::TOPLEVEL-REPL NIL)
9: (SB-IMPL::TOPLEVEL-INIT)
10: ((FLET SB-UNIX::BODY :IN SB-IMPL::START-LISP))
11: ((FLET "WITHOUT-INTERRUPTS-BODY-1" :IN SB-IMPL::START-LISP))
12: (SB-IMPL::START-LISP)
```

**Comment by phmarek** [comment]
Sorry, no.

I meant that the backtrace should be collected when the condition is signalled; IIRC the `handler-case` needs to be changed to a `handler-bind` for that (so that the handler is actually run before the stack is unwound).

**Comment by iamFIREcracker** [comment]
@phmarek:

> > Does the diff above make sense? I can create a PR if need be
> 
> Yes, please.

Here you go: https://github.com/vlime/vlime/pull/66

> > What's the deal with "cffi"? Why do I need to manually load it?
> 
> No idea. Would you please use `(sb-debug:print-backtrace)` or similar to find out what is trying to use `cffi`?

Alright, here is what I did:

```diff
diff --git a/lisp/src/vlime-usocket.lisp b/lisp/src/vlime-usocket.lisp
index 1c1ee24..c9189c1 100644
--- a/lisp/src/vlime-usocket.lisp
+++ b/lisp/src/vlime-usocket.lisp
@@ -110,15 +110,15 @@
 
               (:swank-data
                 (vom:debug "swank-data msg")
-                (handler-case
+                (handler-bind ((error (lambda (c)
+                                        (sb-debug:print-backtrace)
+                                        (let ((msg (format nil "~A" c)))
+                                          (swank/backend:send control-thread `(:swank-data-error ,msg))))))
                   (let ((swank-msg (swank/backend:utf8-to-string (nth 1 msg))))
                     (vom:debug "Message from SWANK: ~s" swank-msg)
                     (write-sequence (msg-swank-to-client swank-msg :octets)
                                     client-stream)
-                    (finish-output client-stream))
-                  (t (c)
-                     (let ((msg (format nil "~A" c)))
-                       (swank/backend:send control-thread `(:swank-data-error ,msg))))))
+                    (finish-output client-stream))))
 
               ((:exit :client-eof :swank-eof :client-data-error :swank-data-error)
                 (vom:info "Control thread stopping: ~s" msg)
```

and this is the stack-trace I got back after the failed "connect":

```


Backtrace for: #<SB-THREAD:THREAD "Vlime Control Thread" RUNNING {10056CD6E3}>
0: ((COMMON-LISP:FLET "H0" :IN VLIME-USOCKET::VLIME-CONTROL-THREAD) #<SB-INT:SIMPLE-READER-PACKAGE-ERROR "Package ~A does n
ot exist." {1005842373}>)
1: (SB-KERNEL::%SIGNAL #<SB-INT:SIMPLE-READER-PACKAGE-ERROR "Package ~A does not exist." {1005842373}>)
2: (COMMON-LISP:ERROR #<SB-INT:SIMPLE-READER-PACKAGE-ERROR "Package ~A does not exist." {1005842373}>)
3: (SB-KERNEL:WITH-SIMPLE-CONDITION-RESTARTS COMMON-LISP:ERROR NIL SB-INT:SIMPLE-READER-PACKAGE-ERROR :PACKAGE "CFFI-FEATUR
ES" :STREAM #<SB-IMPL::STRING-INPUT-STREAM {8617713}> :FORMAT-CONTROL "Package ~A does not exist." :FORMAT-ARGUMENTS ("CFFI
-FEATURES"))
4: (SB-IMPL::READER-FIND-PACKAGE "CFFI-FEATURES" #<SB-IMPL::STRING-INPUT-STREAM {8617713}> T)
5: (SB-IMPL::READ-TOKEN #<SB-IMPL::STRING-INPUT-STREAM {8617713}> #\c)
6: (SB-IMPL::READ-MAYBE-NOTHING #<SB-IMPL::STRING-INPUT-STREAM {8617713}> #\c)
7: (SB-IMPL::READ-LIST #<SB-IMPL::STRING-INPUT-STREAM {8617713}> #<unused argument>)
8: (SB-IMPL::READ-MAYBE-NOTHING #<SB-IMPL::STRING-INPUT-STREAM {8617713}> #\()
9: (SB-IMPL::READ-LIST #<SB-IMPL::STRING-INPUT-STREAM {8617713}> #<unused argument>)
10: (SB-IMPL::READ-MAYBE-NOTHING #<SB-IMPL::STRING-INPUT-STREAM {8617713}> #\()
11: (SB-IMPL::READ-LIST #<SB-IMPL::STRING-INPUT-STREAM {8617713}> #<unused argument>)
12: (SB-IMPL::READ-MAYBE-NOTHING #<SB-IMPL::STRING-INPUT-STREAM {8617713}> #\()
13: (SB-IMPL::READ-LIST #<SB-IMPL::STRING-INPUT-STREAM {8617713}> #<unused argument>)
14: (SB-IMPL::READ-MAYBE-NOTHING #<SB-IMPL::STRING-INPUT-STREAM {8617713}> #\()
15: (SB-IMPL::%READ-PRESERVING-WHITESPACE #<SB-IMPL::STRING-INPUT-STREAM {8617713}> T (NIL) T)
16: (SB-IMPL::%READ-PRESERVING-WHITESPACE #<SB-IMPL::STRING-INPUT-STREAM {8617713}> T (NIL) NIL)
17: (COMMON-LISP:READ #<SB-IMPL::STRING-INPUT-STREAM {8617713}> T NIL NIL)
18: (SB-IMPL::%READ-FROM-STRING #<(COMMON-LISP:SIMPLE-ARRAY COMMON-LISP:CHARACTER (1450)) (:return (:ok (:pid 84903 :style 
:spawn :encoding (:coding-systems ("utf-8-unix" "iso-latin-1-unix")) :lisp-implementation (:type "SBCL" :name "sbcl" :versi
on "2.1.4" :program "/usr/local/Cellar/sbcl/... {100584000F}> T NIL 0 NIL NIL)
19: ((COMMON-LISP:FLET "THUNK" :IN VLIME-PROTOCOL:PARSE-FORM))
20: (SB-IMPL::%WITH-STANDARD-IO-SYNTAX #<FUNCTION (COMMON-LISP:FLET "THUNK" :IN VLIME-PROTOCOL:PARSE-FORM) {861783B}>)
21: (VLIME-PROTOCOL:PARSE-FORM #<(COMMON-LISP:SIMPLE-ARRAY COMMON-LISP:CHARACTER (1450)) (:return (:ok (:pid 84903 :style :
spawn :encoding (:coding-systems ("utf-8-unix" "iso-latin-1-unix")) :lisp-implementation (:type "SBCL" :name "sbcl" :versio
n "2.1.4" :program "/usr/local/Cellar/sbcl/... {100584000F}>)
22: (VLIME-PROTOCOL:MSG-SWANK-TO-CLIENT #<(COMMON-LISP:SIMPLE-ARRAY COMMON-LISP:CHARACTER (1450)) (:return (:ok (:pid 84903
 :style :spawn :encoding (:coding-systems ("utf-8-unix" "iso-latin-1-unix")) :lisp-implementation (:type "SBCL" :name "sbcl
" :version "2.1.4" :program "/usr/local/Cellar/sbcl/... {100584000F}> :OCTETS)
23: (VLIME-USOCKET::VLIME-CONTROL-THREAD #<USOCKET:STREAM-USOCKET {10056CD5A3}> #(3 125 102 39) 12129)
24: ((COMMON-LISP:FLET SB-UNIX::BODY :IN SB-THREAD::RUN))
25: ((COMMON-LISP:FLET "WITHOUT-INTERRUPTS-BODY-11" :IN SB-THREAD::RUN))
26: ((COMMON-LISP:FLET SB-UNIX::BODY :IN SB-THREAD::RUN))
27: ((COMMON-LISP:FLET "WITHOUT-INTERRUPTS-BODY-4" :IN SB-THREAD::RUN))
28: (SB-THREAD::RUN)
29: ("foreign function: call_into_lisp")
30: ("foreign function: funcall1")

debugger invoked on a SB-INT:SIMPLE-READER-PACKAGE-ERROR in thread #<THREAD "Vlime Control Thread" RUNNING {10056CD6E3}>: P
ackage CFFI-FEATURES does not exist. Stream: #<dynamic-extent STRING-INPUT-STREAM (unavailable) from "(:return...">

The current thread is not at the foreground,
SB-THREAD:RELEASE-FOREGROUND has to be called in #<SB-THREAD:THREAD "main thread" RUNNING {1007C382C3}>
for this thread to enter the debugger.
```

and if we zoom in on the `:cffi` related part:

```
ES" :STREAM #<SB-IMPL::STRING-INPUT-STREAM {8617713}> :FORMAT-CONTROL "Package ~A does not exist." :FORMAT-ARGUMENTS ("CFFI
-FEATURES"))
4: (SB-IMPL::READER-FIND-PACKAGE "CFFI-FEATURES" #<SB-IMPL::STRING-INPUT-STREAM {8617713}> T)
5: (SB-IMPL::READ-TOKEN #<SB-IMPL::STRING-INPUT-STREAM {8617713}> #\c)
```

Now, interestingly enough, `:cffi` is a system the _remote_ image I am trying to connect to, is depending on; so I wonder, do we need to load in the _local_ image, i.e. the one running Vlime, all the systems the _remote_ one is depending on?  Because that would explain why I have to `(ql:quickload "cffi")` first, and why @HiPhish needs to QL:QUICKLOAD other systems (systems I guess`:nyxt` is depending on?!)

I am no Swank expert, so apologies if none of the above makes sense / is correct.

**Comment by phmarek** [comment]
> Here you go: #66

Thanks, already saw that ;)

> > > What's the deal with "cffi"? Why do I need to manually load it?
> > No idea. Would you please use `(sb-debug:print-backtrace)` or similar to find out what is trying to use `cffi`?
> Alright, here is what I did:

Thanks, exactly what I meant!


> and if we zoom in on the `:cffi` related part:
> 
> ```
> ES" :STREAM #<SB-IMPL::STRING-INPUT-STREAM {8617713}> :FORMAT-CONTROL "Package ~A does not exist." :FORMAT-ARGUMENTS ("CFFI
> -FEATURES"))
> 4: (SB-IMPL::READER-FIND-PACKAGE "CFFI-FEATURES" #<SB-IMPL::STRING-INPUT-STREAM {8617713}> T)
> 5: (SB-IMPL::READ-TOKEN #<SB-IMPL::STRING-INPUT-STREAM {8617713}> #\c)
> ```
> 
> Now, interestingly enough, `:cffi` is a system the _remote_ image I am trying to connect to, is depending on; so I wonder, do we need to load in the _local_ image, i.e. the one running Vlime, all the systems the _remote_ one is depending on? Because that would explain why I have to `(ql:quickload "cffi")` first, and why @HiPhish needs to QL:QUICKLOAD other systems (systems I guess`:nyxt` is depending on?!)

Looking at that now in more detail (sorry, I seem to have missed that earlier on!), the issue is the `CFFI` pushes non-keywords on `*FEATURES*` -- for me eg. `CFFI-FEATURES:FLAT-NAMESPACE`.
So parsing the features list breaks because of the non-existing package!


> I am no Swank expert, so apologies if none of the above makes sense / is correct.

No, well done! A good analysis!


I'm wondering whether it would be possible for you to test-drive my `vlime` and `swank` branches that use JSON for communication...  As they talk directly, there's no intermediate `vlime-server` needed.

But if you can load the Lisp `vlime` parts on the _remote_ image anyway, you could just have your editor connect to the remote `vlime` as well...

**Comment by HiPhish** [comment]
Sorry for taking so long, here is my backtrace:

```
CL-USER(1): (push #P"/home/hiphish/.local/share/nvim/site-packages/vlime/lisp/" ql:*local-project-directories*)

(#P"/home/hiphish/.local/share/nvim/site-packages/vlime/lisp/"
 #P"/home/hiphish/.local/share/quicklisp/local-projects/")
CL-USER(2):
Unknown command "C-L".
CL-USER(2): (ql:quickload :vlime)
To load "vlime":
  Load 1 ASDF system:
    vlime
; Loading "vlime"
.
(:VLIME)
CL-USER(3): (vlime:main :port 7002 :start-swank nil :swank-port 4006)

; compiling file "/home/hiphish/.local/share/nvim/site-packages/vlime/lisp/src/vlime-usocket.lisp" (written 01 JUL 2021 12:14:09 AM):
; processing (IN-PACKAGE #:CL-USER)
; processing (DEFPACKAGE #:VLIME-USOCKET ...)
; processing (IN-PACKAGE #:VLIME-USOCKET)
; processing (DEFUN SERVER-LISTENER ...)
; processing (DEFUN VLIME-CONTROL-THREAD ...)
; processing (IN-PACKAGE #:VLIME)
; processing (DEFMETHOD START-SERVER ...)

; wrote /home/hiphish/.cache/common-lisp/sbcl-2.1.6-linux-x64/home/hiphish/.local/share/nvim/site-packages/vlime/lisp/src/vlime-usocket-tmpGHU3ALSV.fasl
; compilation finished in 0:00:00.022
NIL
  <INFO> [00:14:39] vlime-usocket - Server created: (#(127 0 0 1) 7002)
CL-USER(4):   <INFO> [00:14:50] vlime-usocket - New client: #<USOCKET:STREAM-USOCKET {1004502EB3}>

Backtrace for: #<SB-THREAD:THREAD "Vlime Control Thread" RUNNING {1004502FE3}>
0: ((COMMON-LISP:FLET "H0" :IN VLIME-USOCKET::VLIME-CONTROL-THREAD) #<SB-INT:SIMPLE-READER-PACKAGE-ERROR "Package ~A does not exist." {100471B7B3}>)
1: (SB-KERNEL::%SIGNAL #<SB-INT:SIMPLE-READER-PACKAGE-ERROR "Package ~A does not exist." {100471B7B3}>)
2: (COMMON-LISP:ERROR #<SB-INT:SIMPLE-READER-PACKAGE-ERROR "Package ~A does not exist." {100471B7B3}>)
3: (SB-KERNEL:WITH-SIMPLE-CONDITION-RESTARTS COMMON-LISP:ERROR NIL SB-INT:SIMPLE-READER-PACKAGE-ERROR :PACKAGE "CHIPZ-SYSTEM" :STREAM #<SB-IMPL::STRING-INPUT-STREAM {7F86DB20E563}> :FORMAT-CONTROL "Package ~A does not exist." :FORMAT-ARGUMENTS ("CHIPZ-SYSTEM"))
4: (SB-IMPL::READER-FIND-PACKAGE "CHIPZ-SYSTEM" #<SB-IMPL::STRING-INPUT-STREAM {7F86DB20E563}> T)
5: (SB-IMPL::READ-TOKEN #<SB-IMPL::STRING-INPUT-STREAM {7F86DB20E563}> #\c)
6: (SB-IMPL::READ-MAYBE-NOTHING #<SB-IMPL::STRING-INPUT-STREAM {7F86DB20E563}> #\c)
7: (SB-IMPL::READ-LIST #<SB-IMPL::STRING-INPUT-STREAM {7F86DB20E563}> #<unused argument>)
8: (SB-IMPL::READ-MAYBE-NOTHING #<SB-IMPL::STRING-INPUT-STREAM {7F86DB20E563}> #\()
9: (SB-IMPL::READ-LIST #<SB-IMPL::STRING-INPUT-STREAM {7F86DB20E563}> #<unused argument>)
10: (SB-IMPL::READ-MAYBE-NOTHING #<SB-IMPL::STRING-INPUT-STREAM {7F86DB20E563}> #\()
11: (SB-IMPL::READ-LIST #<SB-IMPL::STRING-INPUT-STREAM {7F86DB20E563}> #<unused argument>)
12: (SB-IMPL::READ-MAYBE-NOTHING #<SB-IMPL::STRING-INPUT-STREAM {7F86DB20E563}> #\()
13: (SB-IMPL::READ-LIST #<SB-IMPL::STRING-INPUT-STREAM {7F86DB20E563}> #<unused argument>)
14: (SB-IMPL::READ-MAYBE-NOTHING #<SB-IMPL::STRING-INPUT-STREAM {7F86DB20E563}> #\()
15: (SB-IMPL::%READ-PRESERVING-WHITESPACE #<SB-IMPL::STRING-INPUT-STREAM {7F86DB20E563}> T (NIL) T)
16: (SB-IMPL::%READ-PRESERVING-WHITESPACE #<SB-IMPL::STRING-INPUT-STREAM {7F86DB20E563}> T (NIL) NIL)
17: (COMMON-LISP:READ #<SB-IMPL::STRING-INPUT-STREAM {7F86DB20E563}> T NIL NIL)
18: (SB-IMPL::%READ-FROM-STRING #<(COMMON-LISP:SIMPLE-ARRAY COMMON-LISP:CHARACTER (1928)) (:return (:ok (:pid 12206 :style :spawn :encoding (:coding-systems ("utf-8-unix" "iso-latin-1-unix")) :lisp-implementation (:type "SBCL" :name "sbcl" :version "2.1.5" :program "/gnu/store/q12v75p3n5h1... {100471800F}> T NIL 0 NIL NIL)
19: ((COMMON-LISP:FLET "THUNK" :IN VLIME-PROTOCOL:PARSE-FORM))
20: (SB-IMPL::%WITH-STANDARD-IO-SYNTAX #<FUNCTION (COMMON-LISP:FLET "THUNK" :IN VLIME-PROTOCOL:PARSE-FORM) {7F86DB20E68B}>)
21: (VLIME-PROTOCOL:PARSE-FORM #<(COMMON-LISP:SIMPLE-ARRAY COMMON-LISP:CHARACTER (1928)) (:return (:ok (:pid 12206 :style :spawn :encoding (:coding-systems ("utf-8-unix" "iso-latin-1-unix")) :lisp-implementation (:type "SBCL" :name "sbcl" :version "2.1.5" :program "/gnu/store/q12v75p3n5h1... {100471800F}>)
22: (VLIME-PROTOCOL:MSG-SWANK-TO-CLIENT #<(COMMON-LISP:SIMPLE-ARRAY COMMON-LISP:CHARACTER (1928)) (:return (:ok (:pid 12206 :style :spawn :encoding (:coding-systems ("utf-8-unix" "iso-latin-1-unix")) :lisp-implementation (:type "SBCL" :name "sbcl" :version "2.1.5" :program "/gnu/store/q12v75p3n5h1... {100471800F}> :OCTETS)
23: (VLIME-USOCKET::VLIME-CONTROL-THREAD #<USOCKET:STREAM-USOCKET {1004502EB3}> #(127 0 0 1) 4006)
24: ((COMMON-LISP:FLET SB-UNIX::BODY :IN SB-THREAD::RUN))
25: ((COMMON-LISP:FLET "WITHOUT-INTERRUPTS-BODY-11" :IN SB-THREAD::RUN))
26: ((COMMON-LISP:FLET SB-UNIX::BODY :IN SB-THREAD::RUN))
27: ((COMMON-LISP:FLET "WITHOUT-INTERRUPTS-BODY-4" :IN SB-THREAD::RUN))
28: (SB-THREAD::RUN)
29: ("foreign function: call_into_lisp")
30: ("foreign function: funcall1")

debugger invoked on a SB-INT:SIMPLE-READER-PACKAGE-ERROR in thread #<THREAD "Vlime Control Thread" RUNNING {1004502FE3}>: Package CHIPZ-SYSTEM does not exist. Stream: #<dynamic-extent STRING-INPUT-STREAM (unavailable) from "(:return...">

The current thread is not at the foreground,
SB-THREAD:RELEASE-FOREGROUND has to be called in #<SB-THREAD:THREAD "main thread" RUNNING {1004AB81F3}>
for this thread to enter the debugger.
```
